id,year,exam,subject,number,answer,question,data
1,2023,경위,형사,1,4,죄형법정주의에 대한 설명으로 옳은 것은? (다툼이 있는 경우 판례에 의함),"① 헌법재판소의 헌법재판은 법정이 아닌 심판정에서 이루어지므로 법정소동죄 등을 규정한 ｢형법｣ 제138조에서의 ‘법원의 재판’에 헌법재판소의 심판이 포함된다고 해석하는 것은 피고인에게 불리한 확장해석임과 동시에 유추해석이다. ② 행위시에 없던 보호관찰규정이 재판시에 신설되어 법원이 이를 근거로 보호관찰을 명할 경우, 형벌불소급의 원칙 또는 죄형법정주의에 위배된다. ③ 처벌법규의 구성요건은 명확하여야 하므로 처벌법규의 구성요건이 다소 광범위하여 어떤 범위에서는 법관의 보충적인 해석을 필요로 하는 개념을 사용한다면, 이는 헌법이 요구하는 처벌법규의 명확성 원칙에 배치된다.④ 형을 종전보다 가볍게 형벌법규를 개정을 하면서 개정된 법의 시행 전의 범죄에 대하여 종전의 형벌법규를 적용하도록 부칙에 정하는 것은 형벌불소급의 원칙이나 신법우선주의에 반하지 아니한다."
2,2023,경위,형사,2,3,｢형법｣의 적용범위에 대한 설명으로 옳지 않은 것은? (다툼이 있는 경우 판례에 의함),"① ｢형법｣은 범인의 국적과 범죄지 여하를 불문하고 우리나라 형벌법규를 적용하는 세계주의에 관한 조항을 두고 있다. ② 백지형법의 보충규범인 고시가 변경된 경우 변경의 동기를 따져 ‘애당초 잘못된 것이었다’는 법이념상의 반성적 고려에 의한 것이 아닌 한, 그 고시가 변경되기 이전에 범하여진 위반행위에 대한 가벌성이 소멸되는 것은 아니다. ③ 범죄행위시와 재판시 사이에 여러차례 법령이 개정되어 형의 변경이 있는 경우에는 ｢형법｣ 제1조 제2항에 의하여 신법을 적용한다.④ 외국에서 집행된 형은 그것이 형의 전부집행이든 형의 일부집행이든 우리나라 법원이 선고하는 형에 반드시 산입하여야 한다."
3,2023,경위,형사,3,3,부작위범에 대한 설명으로 옳지 않은 것은? (다툼이 있는 경우 판례에 의함),"① 작위의무가 법적으로 인정되는 부진정부작위범이라 하더라도 작위의무를 이행하는 것이 사실상 불가능한 상황이었다면, 부작위범이 성립할 수 없다.② 하나의 행위가 부작위범인 직무유기죄와 작위범인 허위공문서작성죄 및 허위작성공문서행사죄의 구성요건을 동시에 충족하는 경우, 공소제기권자는 작위범인 허위공문서작성죄 및 허위작성공문서행사죄로 공소를 제기하지 아니하고 부작위범인 직무유기죄로만 공소를 제기할 수 있다.③ 진정부작위범은 미수 성립이 불가능하여 ｢형법｣에서는 미수범 처벌규정이 존재하지 않는 반면, 부진정부작위범은 미수 성립이 가능하다. ④ 부작위에 의한 살인에 있어서 작위의무를 이행하였다면 사망의 결과가 발생하지 않았을 것이라는 관계가 인정될 경우, 부작위와 사망의 결과 사이에 인과관계가 인정된다."
4,2023,경위,형사,4,2,인과관계에 대한 설명 중 옳은 것만을 모두 고른 것은? (다툼이 있는 경우 판례에 의함),"가.과실범의 독립행위가 경합하여 결과발생의 원인된 행위가 판명되지 아니한 때에는 각 행위자를 미수범으로 처벌한다. 나. ‘그러한 행위가 없었더라면 그러한 결과도 발생하지 않았을 것’이라는 자연과학적 인과관계를 판단의 척도로 삼는 조건설은 각 조건들을 결과에 대한 동등한 원인으로 간주하여 인과관계의 범위가 지나치게 확장된다는 비판을 받는다.다. 어느 행위로부터 어느 결과가 발생하는 것이 경험칙상 상당하다고 판단될 때 인과관계가 인정되는 상당인과관계설은 인과관계를 일상적인 생활경험으로 제한하여 형사처벌의 확장을 방지하는 장점이 있으나 ‘상당성’의 판단이 모호하여 법적 안정성을 해칠 우려가 있다는 비판을 받는다. 라. 甲에 의한 선행 교통사고와 乙에 의한 후행 교통사고로 A가 사망하였으나 사망의 원인된 행위가 밝혀지지 않은 경우, 乙의 과실과 A의 사망 간에 인과관계가 인정되기 위해서는 乙이 주의의무를 게을리하지 않았다면 A가 사망하지 않았을 것이라는 사실이 증명되어야 하고, 그 증명책임은 乙에게 있다. ① 가 ② 나, 다③ 가, 나, 다 ④ 나, 다, 라"
5,2023,경위,형사,5,4,결과적 가중범에 대한 설명으로 옳지 않은 것은? (다툼이 있는 경우 판례에 의함),"① 교통방해치사죄의 경우 결과발생에 대한 예견가능성은 일반인을 기준으로 객관적으로 판단해야 하므로 일반인의 관점에서 결과발생을 예견할 수 있었다면, 설령 행위자가 결과발생을 구체적으로 예견하지는 못하였다고 하더라도 실제로 발생한 사망의 결과에 대하여 교통방해치사죄가 성립한다.② 결과적 가중범에서 공동정범이 성립하려면 행위를 공동으로 할 의사가 있으면 족하고 결과를 공동으로 할 의사는 필요하지 않다.③ 부진정결과적 가중범에서 고의로 중한 결과를 발생하게 한 행위가 별도의 구성요건에 해당하고 그 고의범의 법정형이 결과적 가중범의 법정형보다 더 무겁게 처벌하는 규정이 없는 경우, 결과적 가중범이 고의범에 대하여 특별관계에 있으므로 결과적 가중범만 성립한다.④ 甲이 A를 강간하려고 폭행하던 중 양심의 가책이 들어 강간행위를 중지하였으나 그 강간행위로 인해 A에게 상해의 결과가 발생한 경우, 강간죄의 중지미수와 과실치상죄의 상상적 경합이 성립한다."
6,2023,경위,형사,6,2,착오에 대한 설명으로 옳지 않은 것은? (다툼이 있는 경우 판례에 의함),"① 甲이 A를 살해하고자 골프채로 A의 머리를 내리쳐 A가 실신하자 사망한 것으로 오인하여 범행을 은폐하기 위해 A를 자동차에 싣고 근처 바닷가 절벽으로 가 던졌는데 실제로는 익사로 판명된 경우, 甲에게는 살인기수의 죄책이 인정된다. ② 甲이 상해의 고의로 A의 머리를 벽돌로 내리쳐 A가 바닥에 쓰러진 채 실신하자 A가 사망한 것으로 오인하여 범행을 은폐하고 A가 자살한 것처럼 위장하기 위하여 A를 절벽 아래로 떨어뜨려 사망에 이르게 하였다면, 甲의 상해행위는 A에 대한 살인에 흡수되어 단일의 살인죄만 인정된다. ③ 甲은 옆집 개가 평소 시끄럽게 짖어 그 개에게 손괴의 고의로 돌을 던졌으나 마침 개가 있는 쪽으로 뛰어나온 어린아이를 맞춰 전치 2주의 상해를 입힌 경우, 구체적 부합설에 의하면 손괴죄의 미수범과 과실치상죄의 상상적 경합이 성립한다. ④ 甲이 乙에게 A에 대한 상해를 교사하여 乙이 이를 승낙하고 실행을 하였으나 A가 그 상해로 인해 사망한 경우, 甲에게 A의 사망에 대한 예견가능성이 인정된다면 상해치사죄의 교사범이 성립한다. (1) 甲은 친구 乙이 돈을 벌고 싶으면 통장과 체크카드를 넘겨달라고 하여 乙이 보이스피싱을 한다는 사실을 알면서 자신의 통장과 체크카드를 넘겨주었다. 여분의 체크카드를 가지고 있던 甲은 통장을 확인하던 중 1,300만 원이 입금된 사실을 확인하고 이를 모두 인출하여 임의로 소비하였는데, 이 돈은 乙로부터 기망당한 A가 송금한 것이었다. (2) 이후 甲은 승용차를 운전하다가 단속 중인 경찰관으로부터 운전면허증 제시를 요구받고 자신의 휴대전화기에 저장된 乙의 운전면허증을 촬영한 이미지 파일을 마치 자신의 운전면허증인 것처럼 제시하였다. (3) 집으로 돌아온 甲은 홧김에 평소 층간소음으로 다툼이 있던 B의 원룸을 향해 돌을 던져 창문을 깨버렸다. 그런데 마침 B는 주식투자 실패로 자살하려고 번개탄을 피워둔 채 실신해 있다가 창문이 깨지는 바람에 생명을 구하게 되었다.(4) 한편 밤에 퇴근하던 丙(女)은 모자를 푹 눌러쓰고 뒤따라오던 甲을 수상하게 여기던 중 우연히 이를 본 乙이 이번 기회에 甲을 혼내줄 생각으로 丙에게 “甲이 추행범이니 한 대 쳐버려!”라고 부추겼고, 이에 丙은 길을 묻기 위해 갑자기 자신의 앞을 가로막은 甲을 추행범으로 오인하고 자신을 방어할 생각으로 甲을 밀어 넘어뜨렸다."
7,2023,경위,형사,7,2,다음 사례에 대한 설명 중 옳은 것은 모두 몇 개인가? (다툼이 있는 경우 판례에 의함),"가. (1)에서 甲에게는 횡령죄가 성립한다.나. (2)에서 甲에게는 공문서부정행사죄가 성립한다.다. (3)에서 甲에게 무죄가 성립한다는 견해에 대해서는 주관적 정당화요소가 있는 경우와 없는 경우 모두 똑같이 취급한다는 비판이 제기된다.라. (4)에서 엄격책임설에 의할 경우 丙의 오인에 정당한 이유가 있다면 丙은 무죄가 되고, 소극적 구성요건표지이론에 의할경우 乙에게 교사범이 성립할 여지가 없다.마. (1)의 사건을 수사하던 사법경찰관 P가 甲과 乙을 긴급체포한 후, 사건이 체포적부심에 계속되어 있던 중 乙의 변호인이 乙의 출석을 보증할만한 보증금을 납입한 경우, 법원은 결정으로 乙의 석방을 명할 수 있다 ① 1개 ② 2개 ③ 3개 ④ 4개"
8,2023,경위,형사,8,3,｢형법｣ 제20조(정당행위)에 대한 설명으로 옳지 않은 것은? (다툼이 있는 경우 판례에 의함),"① 구성요건에 해당하는 행위가 ｢형법｣ 제20조에 따라 위법성이 조각되려면, 첫째 그 행위의 동기나 목적의 정당성, 둘째 행위의 수단이나 방법의 상당성, 셋째 보호법익과 침해법익의 균형성, 넷째 긴급성, 다섯째 그 행위 이외의 다른 수단이나 방법이 없다는 보충성의 요건을 모두 갖추어야 한다. ② ｢형법｣ 제20조에서 ‘사회상규에 위배되지 아니하는 행위’라 함은 국가질서의 존중이라는 인식을 바탕으로 한 국민일반의 건전한 도의적 감정에 반하지 아니한 행위로서 초법규적인 기준에 의하여 이를 평가하여야 한다. ③ 집행관이 조합 소유 아파트에서 유치권을 주장하는 甲을 상대로 부동산인도집행을 실시하여 조합이 그 아파트를 인도받고 출입문의 잠금장치를 교체하는 등으로 그 점유가 확립된 이후에 甲이 아파트 출입문과 잠금장치를 훼손하며 강제로 개방하고 아파트에 들어간 경우, 甲의 행위는 민법상 자력구제에 해당하므로 ｢형법｣ 제20조에 따라 위법성이 조각된다. ④ ｢민사소송법｣ 제335조에 따른 법원의 감정인 지정결정 또는 같은 법 제341조 제1항에 따라 법원의 감정촉탁을 받은 사람이 감정평가업자가 아니었음에도 그 감정사항에 포함된 토지 등의 감정평가를 한 행위는 법령에 근거한 법원의 적법한 결정이나 촉탁에 따른 것으로 ｢형법｣ 제20조에 따라 위법성이 조각된다."
9,2023,경위,형사,9,4,책임에 대한 설명 중 옳은 것만을 모두 고른 것은? (다툼이 있는 경우 판례에 의함),"가.책임비난의 근거를 행위자의 자유의사에서 찾는 도의적 책임론은 행위자책임을 형벌권 행사의 근거로 보기 때문에 책임무능력자에 대한 보안처분 부과를 옹호한다.나.사회적 책임론은 과거에 잘못 형성된 행위자의 성격에서 책임의 근거를 찾으므로 범죄는 행위자의 소질과 환경에 의해 결정된다고 이해한다. 다. 행위 당시 18세였던 甲이 제1심에서 부정기형을 선고받은 후 항소심 선고 이전에 19세에 도달한 경우, 항소심 법원은 甲에 대하여 정기형을 선고하여야 한다.라. ｢형법｣ 제10조에 규정된 심신장애는 정신병 또는 비정상적 정신상태와 같은 정신적 장애가 있는 외에 정신적 장애로 말미암아 사물에 대한 변별능력과 그에 따른 행위통제능력이 결여되거나 감소되었음을 요하므로 정신적 장애가 있는 자라고 하여도 범행 당시 정상적인 사물변별능력이나 행위통제능력이 있었다면 심신장애로 볼 수 없다. 마. 음주습벽이 있는 甲이 음주운전을 할 의사를 가지고 음주만취하여 심신상실상태에서 운전을 결행하여 부주의로 보행자 A를 충격하여 현장에서 즉사시키고 도주하였다면, 이는 음주시에 교통사고를 일으킬 위험성을 예견하였는데도 자의로 심신장애를 야기한 경우에 해당하므로 甲에 대한 형사처벌이 가능하다. ① 가, 다, 라② 나, 라, 마③ 다, 라, 마④ 나, 다, 라, 마"
10,2023,경위,형사,10,2,｢형법｣상 예비죄에 대한 설명 중 옳지 않은 것만을 모두 고른 것은? (다툼이 있는 경우 판례에 의함),"가.형법각칙의 예비죄를 처단하는 규정을 바로 독립된 구성요건 개념에 포함시킬 수는 없다고 하는 것이 죄형법정주의에 부합한다. 나.예비와 미수는 각각 형법각칙에 처벌규정이 있는 경우에만 처벌할 수 있지만 구체적인 법정형까지 규정될 필요는 없다.다.예비죄를 처벌하는 범죄의 예비단계에서 자의로 중지를 하였다면, 예비죄의 중지미수가 성립한다. 라.살인예비죄가 성립하기 위하여는 살인죄를 범할 목적이 있어야 할 뿐만 아니라 살인의 준비에 관한 고의도 있어야 한다.마.정범의 실행 착수 전에 장래의 실행행위를 예상하고 이를 용이하게 하는 행위를 하여 방조한 경우, 정범이 실행의 착수에 이르지 못했다면 방조자는 종범이 성립되지 않지만 정범이 그 실행행위로 나아갔다면 종범이 성립한다. ① 가, 나 ② 나, 다③ 가, 다, 마 ④ 다, 라, 마"
11,2023,경위,형사,11,4,공범에 대한 설명으로 옳지 않은 것은? (다툼이 있는 경우 판례에 의함),① 교사를 받은 자가 범죄의 실행을 승낙하지 아니한 때에는 교사자만을 음모 또는 예비에 준하여 처벌한다. ② 필요적 공범이라는 것은 법률상 범죄의 실행이 다수인의 협력을 필요로 하는 것을 가리키는 것으로서 이러한 범죄의 성립에는 행위의 공동을 필요로 하는 것에 불과하고 반드시 협력자 전부가 책임이 있음을 필요로 하는 것은 아니다. ③ 공모공동정범에 있어서의 공모는 범죄사실을 구성하는 것으로서 이를 인정하기 위해서는 엄격한 증명이 요구된다. ④ 정범에 의한 법익침해의 위험을 증대시키면 방조범이 성립하므로 방조범에서는 인과관계가 요구되지 아니한다.
12,2023,경위,형사,12,1,공범과 신분에 대한 설명 중 옳은 것만을 모두 고른 것은? (다툼이 있는 경우 판례에 의함),"가. 비신분자가 신분관계로 인하여 성립될 범죄에 가공한 경우 비신분자에게 공동가공의 의사와 이에 기초한 기능적 행위지배를 통한 범죄의 실행이라는 주관적·객관적 요건이 충족되면 신분자와 공동정범이 성립한다.나. 甲이 친구 乙과 공모하여 자신의 아버지를 살해한 경우, 乙은 존속살해죄의 공동정범이 성립하나 보통살인죄에 정한 형으로 처단된다. 다. 도박의 습벽이 있는 甲이 도박을 하고 또한 도박의 습벽이 없는 A의 도박을 방조한 경우, 甲은 상습도박죄와 도박방조죄가 성립하고 양죄는 실체적 경합관계에 있다.라. 甲이 공무원인 자신의 남편 A에게 채무변제로 받는 돈이라고 속여 A로 하여금 뇌물을 받게 한 경우, 甲은 ｢형법｣ 제33조에 의해 수뢰죄의 간접정범으로 처벌된다. ① 가, 나 ② 나, 라 ③ 다, 라 ④ 가, 나, 라"
13,2023,경위,형사,13,2,죄수에 대한 설명으로 옳은 것은? (다툼이 있는 경우 판례에 의함),"① 징역형만 규정된 A죄와 징역형과 벌금형의 임의적 병과규정이 있는 B죄가 상상적 경합관계에 있는 경우, A죄에 정해진 징역형의 상한이 B죄에 정해진 징역형의 상한보다 높다면 A죄에서 정한 징역형으로 처벌해야 하고 벌금형은 병과할 수 없다. ② 甲이 상습절도죄(A죄)로 X법원으로부터 징역형을 선고받고 확정된 후 동일한 습벽이 있는 별개의 B죄를 저질러 Y법원에서 심리 중이었는데 확정된 A죄에 대한 X법원의 적법한 재심심판절차에서 징역형이 선고되어 확정된 경우, 별개로 기소된 B죄를 심판하는 Y법원은 B죄에 대하여 ｢형법｣ 제39조 제1항에 의한 형의 감경 또는 면제를 할 수 없다.③ 甲이 A를 살해할 목적으로 흉기를 구입하여 A의 집 앞에서 A를 기다렸으나 만나지 못하였고 다음날 A의 맥주잔에 독약으로 오인한 제초제를 몰래 넣었으나 복통만 일으키게 하다가 며칠 뒤 A를 자동차로 치어 사망하게 한 경우, 甲에게는 살인예비 내지 미수죄와 동 기수죄의 경합죄가 성립한다. ④ 운전면허시험에 계속 불합격하였으나 운전을 잘하던 甲이 영업을 하기 위해 자동차를 구입하여 일주일 동안 매일 매일 운전 해오다가 적발된 경우, 甲에게는 포괄하여 도로교통법위반(무면허운전)의 일죄가 성립한다."
14,2023,경위,형사,14,4,상해와 폭행에 관련된 설명으로 옳은 것은? (다툼이 있는 경우 판례에 의함),"① 甲이 자신의 차를 가로막는 A를 부딪히지는 않은 채 부딪칠 듯이 차를 조금씩 전진시키는 것을 반복하는 행위는 A에 대해 위법한 유형력을 행사한 것으로 보기 어렵다.② 특수폭행치상의 경우 ｢형법｣ 제258조의2(특수상해)가 신설되었으므로 특수상해죄의 예에 의하여 처벌해야 한다.③ 甲과 乙이 공동하여 A를 폭행한 경우 A의 명시한 의사에 반하여 甲과 乙에 대한 공소를 제기할 수 없다.④ 강간범죄의 피해자가 겪은 불안, 불면, 악몽, 자책감, 우울감정, 대인감정 회피 등의 증상은 외상후 스트레스 장애(PTSD)로서 강간치상죄의 상해에 포함된다."
15,2023,경위,형사,15,1,다음 설명 중 옳지 않은 것은? (다툼이 있는 경우 판례에 의함),"① ｢형법｣ 제114조(범죄단체 등의 조직)에서 정한 ‘범죄를 목적으로 하는 집단’이란 특정 다수인이 일정한 범죄를 수행한다는 공동목적 아래 구성한 계속적인 결합체로서 그것을 주도하거나 내부의 질서를 유지하는 최소한의 통솔체계를 갖춘 것을 의미한다.② 노상에서 전봇대 주변에 놓인 재활용품과 쓰레기 등 무주물에 불을 놓아 태워버린 경우 그 무주물은 ｢형법｣ 제167조 제2항에 정한 ‘자기 소유의 물건’에 준하는 것으로 보아야 하므로 자기소유일반물건방화죄가 성립한다.③ 현주건조물방화죄의 주된 보호법익은 공공의 안전이고, 부차적인 보호법익은 개인의 재산권이다.④ 甲이 국가정보원 직원임을 사칭하면서 위임받은 채권추심을 한 경우 ｢형법｣상 공무원자격사칭죄가 성립하지 아니한다."
16,2023,경위,형사,16,2,강간과 추행의 죄에 대한 설명 중 옳지 않은 것은 모두 몇 개인가? (다툼이 있는 경우 판례에 의함),"가. 비록 간음행위를 시작할 때 폭행 또는 협박이 없었다고 하더라도 간음행위와 거의 동시 또는 그 직후에 피해자를 폭행하여 간음한 경우에는 강간죄를 구성한다.나. 부부의 혼인관계가 파탄에 이르지 아니하고 실질적으로 유지되고 있다면 설령 부부 중 일방이 반항을 불가능하게 하거나 현저히 곤란하게 할 정도의 폭행이나 협박을 가하여 상대방을 간음한 경우라도 강간죄가 성립하지 아니한다. 다. ｢형법｣ 제32장 강간과 추행의 죄는 개인의 성적 자유를 침해하는 것을 내용으로 하며, 여기에서 ‘성적 자유’는 적극적으로 성행위를 할 수 있는 자유뿐만 아니라 소극적으로 원치 않는 성행위를 하지 아니할 자유를 말한다.라. 강제추행죄는 폭행행위 자체가 추행행위라고 인정되는 경우도 포함하며, 이 경우의 폭행은 반드시 상대방의 의사를 억압할 정도의 것임을 요하지 아니한다.마. 甲이 A가 심신상실 또는 항거불능의 상태에 있다고 인식하고 그러한 상태를 이용하여 간음할 의사로 A를 간음하였으나 A가 실제로는 심신상실 또는 항거불능 상태에 있지 않았던 경우, 甲에게는 준강간죄의 장애미수가 성립한다. ① 2개 ② 3개 ③ 4개 ④ 5개"
17,2023,경위,형사,17,2,명예에 관한 죄에 대한 설명 중 옳은 것은 모두 몇 개인가? (다툼이 있는 경우 판례에 의함),"가. 집단표시에 의한 모욕의 경우 구성원 개개인에 대한 모욕으로 여겨질 정도로 구성원 수가 적거나 당시의 정황 등으로 보아 집단 내 개별구성원을 지칭하는 것으로 여겨질 수 있다면, 집단의 개별구성원에 대한 모욕죄가 성립한다. 나. 甲이 인터넷 개인 블로그의 비공개 대화방에서 OO이라는 아이디를 사용하는 자로부터 비밀을 지키겠다는 말을 듣고 일대일로 대화한 경우, OO이라는 아이디를 사용하는 자가 대화내용을 불특정 또는 다수에게 전파할 가능성이 없으므로 명예훼손죄의 공연성이 부정된다.다. 가해학생 A로부터 학교폭력 피해를 입은 B학생의 어머니 甲이 학교폭력을 신고하여 학교폭력대책자치위원회의 의결에 따라 ‘B에 대한 접촉, 보복행위의 금지’ 등의 조치가 있은 후, 甲이 자신의 SNS 계정 프로필 상태메시지에 “학교폭력범은 접촉금지!!”라는 글과 주먹 모양의 그림말 3개를 게시한 경우, 甲에게는 A에 대한 명예훼손죄가 성립한다.라. 甲이 신문기자와의 전화인터뷰에서 타인의 명예를 훼손하는 취지의 이야기를 하였으나 그 기자가 이러한 甲의 진술을 아직 기사화하여 보도하지 아니한 경우, 명예훼손죄의 공연성이 부정된다. ① 1개 ② 2개 ③ 3개 ④ 4개"
18,2023,경위,형사,18,1,형법상 점유에 대한 설명으로 옳지 않은 것은? (다툼이 있는 경우 판례에 의함),"① 甲이 마치 귀금속을 구입할 것처럼 가장하여 금은방 주인으로부터 순금목걸이를 건네받은 다음 화장실에 갔다 오겠다는 핑계를 대고 도주하는 경우, 그 목걸이는 도주하기 전부터 이미 甲의 점유하에 있다.② 고속버스 운전사는 승객이 차내에 두고 내린 물건을 점유하는 것이 아니고, 승객이 잊고 내린 유실물을 교부받을 권능을 가질 뿐이므로 그 물건을 현실적으로 발견하지 아니하는 한 이에 대한 점유를 개시하였다고 할 수 없다.③ 甲에게 강간을 당한 피해자 A가 도피하면서 자신의 지갑을 현장에 놓아두고 간 경우, 그 지갑은 사회통념상 A의 지배 하에 있는 물건이므로 甲이 그 지갑을 가져갔다면 절도죄를 구성한다.④ 공동점유의 경우에 공동점유자 중 1인이 다른 점유자의 동의를 받지 않고 불법영득의사를 가지고 물건을 자신의 단독점유로 옮긴 때에는 절도죄가 성립한다."
19,2023,경위,형사,19,3,친족상도례에 대한 설명으로 옳지 않은 것은? (다툼이 있는 경우 판례에 의함),"① 사돈 사이 및 사실혼 관계에 있는 배우자는 친족상도례의 적용을 받지 아니한다. ② 절도죄에서 친족상도례가 적용되기 위해서는 범인과 피해물건의 소유자 및 점유자 모두 간에 친족관계가 있어야 한다. ③ 동거하지 않는 형제의 재물을 강취한 경우에 강도죄에 해당하나, 그 형이 면제된다. ④ 사기죄를 범하는 자가 혼인의 의사 없이 금원을 편취하기 위한 수단으로 A와 혼인신고를 한 것이어서 그 혼인이 무효인 경우라면, A에 대한 사기죄에서는 친족상도례를 적용할 수 없다."
