id,year,exam,subject,number,answer,question,data
264,2023,경위,민법,24,2,사기에 의한 의사표시에 관한 설명 중 옳지 않은 것은? (다툼이 있는 경우 판례에 의함),"① 아파트단지 인근에 대규모 공동묘지가 조성되어 있는 사실을 알고 있는 아파트 분양자는 그 사실을 알지 못하는 수분양자에게 이를 고지할 신의칙상 의무를 부담하므로 그 사실을 고지하지 아니한 것은 부작위에 의한 기망행위에 해당한다. ② 의사표시자가 상대방의 대리인에 의한 사기에 따라 의사표시를 한 경우에도 상대방이 선의 및 무과실이라면 의사표시자는 그 의사표시를 취소할 수 없다. ③ 의사표시자가 제3자의 사기로 상대방에게 의사표시를 한 경우, 상대방이 의사표시를 수령할 당시 그 사실을 알았다면 의사표시자는 그 의사표시를 취소할 수 있다. ④ 당사자가 거래에 있어서 중요한 사항에 관하여 구체적 사실을 신의성실의 의무에 비추어 비난받을 정도의 방법으로 그 사실을 알지 못하는 상대방에게 허위로 고지한 것은 기망행위에 해당한다."
265,2023,경위,민법,25,4,강박에 의한 의사표시에 관한 설명 중 옳지 않은 것은? (다툼이 있는 경우 판례에 의함),"① 부정행위에 대한 고소 또는 고발이 부정한 이익의 취득을 목적으로 하는 경우에는 위법한 강박행위가 될 수 있다. ② 강박행위는 강박자의 고의에 의해서만 성립하고, 과실에 의해서는 성립하지 않는다. ③ 상대방의 강박이 의사표시자의 의사결정의 자유를 완전히 박탈하는 정도에 이르지 아니하고 이를 제한하는 정도에 그친 경우, 그 의사표시자의 의사표시는 취소할 수 있음에 그치고 무효라고 볼 수 없다. ④ 강박에 의한 의사표시의 취소에 대해 대항하고자 하는 제3자는 자신의 선의를 증명하여야 한다."
266,2023,경위,민법,26,4,"의사표시의 효력 발생에 관한 설명 중 옳지 않은 것은? (특별한 사정이 있는 경우를 제외하며, 다툼이 있는 경우 판례에 의함)","① 상대방 없는 의사표시의 효력은 표시행위가 완료된 때에 생긴다. ② 의사표시자가 통지를 발송한 후 사망한 경우에 그 자의 사망은 의사표시의 효력에 영향을 미치지 않는다. ③ 무권대리의 상대방이 본인에게 추인 여부의 확답을 최고한 경우, 본인의 확답의 효력은 그 의사표시를 발한 때에 발생한다. ④ 의사표시를 받은 상대방이 피특정후견인인 경우, 의사표시자는 의사표시로써 그 상대방에게 대항할 수 없다."
267,2023,경위,민법,27,3,대리에 관한 설명 중 옳지 않은 것은? (다툼이 있는 경우 판례에 의함),"① 대리권을 수여한 본인은 대리인이 제한능력자임을 이유로 대리행위를 취소할 수 없다. ② 대리인에게 대리권이 있다는 것에 대한 증명책임은 대리행위가 유효하다고 주장하는 자에게 있다. ③ 수동대리의 경우 상대방이 본인에 대한 의사표시임을 대리인에게 표시하지 않더라도 본인에게 그 효력이 생긴다. ④ 대리인이 본인을 위한 것임을 표시하지 아니한 경우, 그 의사표시의 상대방이 대리인으로서 한 것임을 알았거나 알 수 있었을 때에는 직접 본인에 대하여 효력이 생긴다."
268,2023,경위,민법,28,2,임의대리권에 관한 설명 중 옳지 않은 것은? (다툼이 있는 경우 판례에 의함),"① 부동산의 소유자로부터 매매계약 체결의 대리권을 수여받은 대리인은 특별한 사정이 없는 한 잔금을 수령할 권한이 있다. ② 대여금의 영수권한만을 위임받은 대리인은 본인의 특별수권이 없더라도 대여금채무의 일부를 면제할 수 있다. ③ 특별한 사정이 없는 한, 본인을 대리하여 금전소비대차 내지 그를 위한 담보권설정계약을 체결할 권한을 수여받은 대리인에게 본래의 계약관계를 해제할 대리권까지 있다고 볼 수 없다. ④ 매매계약의 체결과 이행에 관하여 포괄적으로 대리권을 수여받은 대리인은 특별한 사정이 없는 한 상대방에 대하여 약정된 매매대금 지급기일을 연기해 줄 권한도 가진다고 볼 수 있다."
269,2023,경위,민법,29,4,대리권의 범위와 제한에 관한 설명 중 옳지 않은 것은? (다툼이 있는 경우 판례에 의함),"① 특별한 사정이 없는 한, 본인의 허락이 있으면 쌍방대리도 허용된다. ② 대리인이 수인인 경우, 법률 또는 수권행위에 다른 정한 바가 없는 한 각자가 본인을 대리한다. ③ 권한을 정하지 아니한 대리인은 대리의 목적인 물건이나 권리의 성질을 변하지 아니하는 범위에서 그 이용 또는 개량하는 행위를 할 수 있다. ④ 해산한 법인의 대표청산인이 정관 규정에 따라 잔여재산이전의무의 이행으로서 잔여재산을 그 대표청산인이 대표자를 겸하고 있던 귀속권리자에게 이전하는 경우 쌍방대리 금지에 반한다."
270,2023,경위,민법,30,3,甲의 임의대리인 乙은 자신의 이름으로 甲의 대리인 丙을 선임하였다. 다음 설명 중 옳은 것을 모두 고른 것은? (다툼이 있는 경우 판례에 의함),"가. 甲과 丙 사이에는 어떠한 권리·의무관계도 없다.나. 乙은 甲의 승낙으로 丙을 선임하였더라도 甲에 대하여 丙의 선임·감독에 관한 책임을 진다.다. 丙이 甲의 지명으로 선임된 경우, 乙은 丙의 불성실함을 알면서도 甲에게 통지나 그 해임을 태만하였다면 책임이 있다.라. 丙이 甲의 지명으로 선임된 경우, 乙의 대리권이 소멸하더라도 丙의 대리권은 소멸하지 않는다. ① 가. 나. ② 가. 라. ③ 나. 다. ④ 다. 라."
271,2023,경위,민법,31,4,표현대리에 관한 설명 중 옳지 않은 것은? (다툼이 있는 경우 판례에 의함),"① 소송행위에는 ｢민법｣상 표현대리 규정이 적용되지 않는다. ② 법률행위가 강행법규에 위반되어 무효인 이상 표현대리의 법리가 준용될 여지는 없다. ③ 표현대리가 성립하는 경우, 상대방에게 과실이 있다고 하더라도 과실상계의 법리를 유추적용하여 본인의 책임을 경감할 수 없다. ④ 사회통념상 대리권을 추단할 수 있는 직함이나 명칭 등의 사용을 묵인한 것만으로 대리권수여의 표시가 있었다고 할 수 없다."
272,2023,경위,민법,32,2,｢민법｣ 제126조(권한을 넘은 표현대리)에 관한 설명 중 옳지 않은 것은? (다툼이 있는 경우 판례에 의함),① 권한을 넘은 표현대리 규정은 법정대리에도 적용된다. ② 대리인이 임의로 선임한 복대리인을 통하여 권한 외의 법률행위를 한 경우 ｢민법｣ 제126조의 표현대리가 성립할 수 없다. ③ 무권대리인에게 권한이 있다고 믿을 만한 정당한 이유가 있는가의 여부는 대리행위가 행하여질 때에 존재하는 모든 사정을 객관적으로 관찰하여 판단하여야 한다. ④ 대리인이 본인을 위한 것임을 표시하지 아니하고 사술을 써서 자기가 마치 본인인 것처럼 상대방을 기망하여 본인 명의로 직접 법률행위를 한 경우에는 특별한 사정이 없는 한 권한을 넘은 표현대리가 성립하지 않는다.
273,2023,경위,민법,33,3,무효에 관한 설명 중 옳지 않은 것은? (다툼이 있는 경우 판례에 의함),"① 무효행위의 추인은 그 무효원인이 소멸한 후에 하여야 효력이 있다. ② 특별한 사정이 없는 한, 법률행위가 불공정한 법률행위로서 무효인 경우 추인에 의하여 유효로 될 수 없다. ③ 무효인 법률행위는 그 법률행위가 성립한 당초부터 당연히 효력이 발생하지 않지만, 무효인 법률행위에 따른 법률효과를 침해하는 것처럼 보이는 위법행위나 채무불이행이 있다면 그로 인한 손해배상을 청구할 수 있다. ④ 무효행위의 추인이 있었다는 사실에 대한 증명책임은 새로운 법률행위의 성립을 주장하는 자에게 있다."
274,2023,경위,민법,34,2,"乙은 대리권 없이 甲의 대리인으로서 丙과 매매계약을 체결하였고, 자신의 대리권과 관련하여 丙과 별도로 약정하지 않았다. 이에 관한 설명 중 옳지 않은 것은? (표현대리는 성립하지 않고, 다툼이 있는 경우 판례에 의함)","① 甲은 매매계약의 추인을 乙 또는 丙에게 할 수 있다. ② 丙이 무권대리로 인하여 취득한 권리를 양도하였다면 甲은 그 양수인에게 추인하지 못한다. ③ 丙이 乙의 대리권 없음을 알았거나 알 수 있었을 경우, 乙은 무권대리인의 책임을 지지 않는다. ④ 乙이 그 대리권을 증명하지 못하고 또 甲의 추인을 받지 못한 경우, 乙의 대리권 없음에 대하여 선의 및 무과실인 丙은 乙에게 계약의 이행을 청구할 수 있다."
275,2023,경위,민법,35,4,조건에 관한 설명 중 옳지 않은 것은? (다툼이 있는 경우 판례에 의함),① 당사자는 조건성취 전에 조건성취의 효력을 소급하게 할 수 있다. ② 해제조건이 법률행위의 당시 이미 성취한 것인 경우에는 그 법률행위는 무효로 한다. ③ 조건의사가 있더라도 그것이 외부에 표시되지 않으면 그것만으로는 법률행위 부관으로서의 조건이 되는 것은 아니다. ④ 조건부 법률행위에 있어 조건의 내용 자체가 선량한 풍속 기타 사회질서에 위반하는 것이어서 무효일 경우 그 조건만을 분리하여 무효로 할 수 있다.
276,2023,경위,민법,36,13,부관에 관한 설명 중 옳지 않은 것은? (다툼이 있는 경우 판례에 의함),"① 당사자가 불확정한 사실이 발생한 때를 이행기한으로 정한 경우, 그 사실의 발생이 불가능하게 된 때에는 그 이행기한이 도래한 것으로 볼 수 없다. ② 조건의 성취로 인하여 이익을 받을 당사자가 신의성실에 반하여 조건을 성취시킨 때에는 상대방은 그 조건이 성취하지 아니한 것으로 주장할 수 있다. ③ 기한이익상실의 특약이 명백히 형성권적 기한이익상실의 특약이라고 볼 만한 특별한 사정이 없는 이상 정지조건부 기한이익상실의 특약으로 추정하는 것이 타당하다. ④ 부관에 표시된 사실이 발생한 때에는 물론이고 반대로 발생하지 않은 것이 확정된 때에도 채무를 이행하여야 한다고 보는 것이 합리적인 경우에는 표시된 사실 발생 여부가 확정되는 것을 불확정기한으로 정한 것으로 본다."
277,2023,경위,민법,37,4,"기간에 관한 설명 중 옳지 않은 것은? (토요일 또는 공휴일을 고려하지 않고, 다툼이 있는 경우 판례에 의함)","① 2002.12.1. 10시에 출생한 사람은 2021.12.1. 0시부터 성년자가 된다. ② ｢민법｣ 제71조에 따라 사단법인의 사원총회 소집을 1주일 전까지 통지하여야 하는 경우, 사원총회일이 2001.8.9. 14시라면 늦어도 2001.8.1. 24시까지는 총회소집의 통지를 발송하여야 한다. ③ 2010.3.12. 17시에 금전을 대여하면서 그 계약 기간을 2년으로 한 경우, 그 기간은 2012.3.12. 24시에 만료한다. ④ 기간을 일, 주, 월 또는 연으로 정한 경우 기간의 초일을 산입하지 아니하도록 한 것은 당사자의 약정으로 달리 정할 수 없다."
278,2023,경위,민법,38,2,소멸시효에 관한 설명 중 옳지 않은 것은? (다툼이 있는 경우 판례에 의함),① 채무자가 소멸시효 완성 후에 그 사실을 알고 채권자에 대하여 채무 일부를 변제함으로써 시효의 이익을 포기한 경우에는 그때부터 새로이 소멸시효가 진행한다. ② 소멸시효가 완성된 경우 채무자의 일반채권자는 자기의 채권 보전을 위하여 필요한 한도 내에서 채무자를 대위하는 방법으로도 시효 소멸을 주장할 수 없다. ③ 소멸시효이익의 포기사유로서 묵시적 승인은 적어도 채무자가 채권자에 대하여 부담하는 채무의 존재에 대한 인식의 의사를 표시함으로써 성립한다. ④ 부진정연대채무에서 채무자 1인에 대한 재판상 청구는 다른 채무자에게 시효 중단의 효력을 발생시키지 않는다.
279,2023,경위,민법,39,1,3년의 소멸시효에 걸리는 채권에 관한 설명 중 옳지 않은 것은? (다툼이 있는 경우 판례에 의함),① 금전채무의 이행지체로 인한 지연손해금채권도 이자채권에 해당한다. ② 변제기가 1년 이내인 채권은 1년 이내의 기간으로 정한 채권에 해당하지 않는다. ③ 도급받은 자의 공사에 관한 채권에는 공사대금채권뿐만 아니라 그 공사에 부수되는 채권도 포함된다. ④ 전기요금채권은 생산자 및 상인이 판매한 생산물 및 상품의 대가에 해당한다.
280,2023,경위,민법,40,1,소멸시효 중단 또는 정지에 관한 설명 중 옳은 것을 모두 고른 것은? (다툼이 있는 경우 판례에 의함),"가. 임의출석의 경우에 화해가 성립되지 아니한 때에는 1월 내에 소를 제기하지 아니하면 시효중단의 효력이 없다.나. 소멸시효의 중단사유로서의 승인과 관련하여 현존하지 아니하는 장래의 채권을 미리 승인하는 것은 채무자가 그 권리의 존재를 인식하고서 한 것이라고 볼 수 없어 허용되지 않는다.다. 채권자가 물상보증인 소유의 부동산에 대하여 압류를 한 경우, 채무자에게 압류사실이 통지되어야만 시효 중단의 효력이 그 채무자에게 미치게 된다.라. 천재 기타 사변으로 인하여 소멸시효를 중단할 수 없을 때에는 그 사유가 종료한 때로부터 6월내에는 시효가 완성하지 아니한다. ① 가. 나. 다. ② 가. 나. 라. ③ 가. 다. 라. ④ 나. 다. 라."
281,2024,경위,형사,1,1,죄형법정주의에 관한 설명으로 가장 적절하지 않은 것은? (다툼이 있는 경우 판례에 의함),"① 형사처벌의 근거가 되는 것은 법률과 판례이므로 ｢형법｣ 조항에 관한 판례의 변경은 그 법률조항 자체가 변경된 것으로 보아 행위 당시의 판례에 의하면 처벌대상이 되지 아니하는 것으로 해석되었던 행위를 판례의 변경에 따라 확인된 내용의 ｢형법｣ 조항에 근거하여 처벌하는 것은 헌법상 평등의 원칙과 형벌불소급의 원칙에 반한다.② 형벌을 신설하거나 가중하는 형법법규는 그 시행 이후에 이루어진 행위에 대하여만 적용되고 시행 이전의 행위에까지 소급하여 적용될 수 없다는 것이 소급효금지원칙인데, 이때 소급효는 형벌에 대해서 적용되며, 자유형이든, 벌금형이든, 주형이든, 부가형이든 묻지 않는다. ③ 처벌법규의 입법목적이나 그 전체적 내용, 구조 등을 살펴보아 사물의 변별능력을 제대로 갖춘 일반인의 이해와 판단으로서 그의 구성요건 요소에 해당하는 행위유형을 정형화하거나 한정할 합리적 해석기준을 찾을 수 있다면 죄형법정주의가 요구하는 형벌법규의 명확성의 원칙에 반하지 않는다.④ 위법성 및 책임의 조각사유나 소추조건, 또는 처벌조각사유인 형면제 사유에 관하여 그 범위를 제한적으로 유추적용하게 되면 행위자의 가벌성의 범위는 확대되어 행위자에게 불리하게 되므로 유추해석금지의 원칙에 반한다."
282,2024,경위,형사,2,4,위임입법에 관한 설명으로 옳은 것은 모두 몇 개인가? (다툼이 있는 경우 판례에 의함),"가.헌법은 법률에서 구체적으로 범위를 정하여 위임받은 사항에 관하여 하위법령에 규정하는 것을 허용한다.나.법률의 시행령이나 시행규칙의 내용이 모법의 입법 취지와 관련 조항 전체를 유기적·체계적으로 살펴보아 모법의 해석상 가능한 것을 명시한 것에 지나지 아니하거나 모법 조항의 취지에 근거하여 이를 구체화하기 위한 것인 때에는 모법에 이에 관하여 직접 위임하는 규정을 두지 아니하였다고 하더라도 이를 무효라고 볼 수는 없다.다.법률의 시행령이 형사처벌에 관한 사항을 규정하면서 법률의 명시적인 위임 범위를 벗어나 그 처벌의 대상을 확장하는 것은 죄형법정주의의 원칙에도 어긋나는 것이므로, 그러한 시행령은 위임입법의 한계를 벗어난 것으로서 무효이다.라.형벌법규의 위임은 특히 긴급한 필요가 있거나 미리 법률로써 자세히 정할 수 없는 부득이한 사정이 있는 경우로 한정되어야 하며, 이러한 경우에도 법률에서 범죄의 구성요건은 처벌대상행위가 어떠한 것일 것이라고 예측할 수 있을 정도로 구체적으로 정하여야 한다. ① 1개 ② 2개③ 3개 ④ 4개"
283,2024,경위,형사,3,3,위험범에 관한 설명으로 옳지 않은 것을 모두 고른 것은? (다툼이 있는 경우 판례에 의함),"가.｢형법｣ 제230조의 공문서부정행사죄는 공무원 또는 공무소의 문서 또는 도화를 부정행사함으로써 성립하는 죄로 추상적 위험범에 해당한다.나.｢형법｣ 제185조의 일반교통방해죄는 육로, 수로 또는 교량을 손괴 또는 불통하게 하거나 기타 방법으로 교통을 방해함으로써 성립하는 죄로 구체적 위험범에 해당한다.다.｢형법｣ 제158조의 장례식방해죄는 장례식을 방해함으로써 성립하는 죄로 구체적 위험범에 해당한다.라.｢형법｣ 제307조의 명예훼손죄는 공연히 사실 또는 허위의 사실을 적시하여 사람의 명예를 훼손함으로써 성립하는 죄로 추상적 위험범에 해당한다.① 가, 나 ② 가, 라 ③ 나, 다 ④ 다, 라"
284,2024,경위,형사,4,1,인과관계에 관한 설명으로 가장 적절하지 않은 것은?(다툼이 있는 경우 판례에 의함),"① 甲은 주식회사를 운영하면서 발주처로부터 공사완성의 대가로 공사대금을 지급받았으나, 법인 인수 과정에서 법인 등록요건 중 인력요건을 외형상 갖추기 위해 관련 자격증 소지자들로부터 자격증을 대여받은 사실을 발주처에 숨기는 행위를 하였다면, 그 기망행위와 공사대금 지급 사이에 상당인과관계가 인정된다.② 자동차의 운전자가 통상 예견되는 상황에 대비하여 결과를 회피할 수 있는 정도의 주의의무를 다하지 못한 것이 교통사고 발생의 직접적인 원인이 되었다면, 비록 자동차가 보행자를 직접 충격한 것이 아니고 보행자가 자동차의 급정거에 놀라 도로에 넘어져 상해를 입은 경우라고 할지라도, 업무상 주의의무 위반과 교통사고 발생 사이에 상당인과관계를 인정할 수 있다.③ 살인의 실행행위가 피해자의 사망이라는 결과를 발생하게 한 유일한 원인이거나 직접적인 원인이어야만 되는 것은 아니므로, 살인의 실행행위와 피해자의 사망과의 사이에 다른 사실이 개재되어 그 사실이 치사의 직접적인 원인이 되었다고 하더라도 그와 같은 사실이 통상 예견할 수 있는 것에 지나지 않는다면 살인의 실행행위와 피해자의 사망과의 사이에 인과관계가 인정된다.④ 의사가 설명의무를 위반한 채 의료행위를 하였다가 환자에게 사망의 결과가 발생한 경우, 의사에게 업무상 과실로 인한 형사책임을 지우기 위해서는 의사의 설명의무 위반과 환자의 사망 사이에 상당인과관계가 존재하여야 한다."
285,2024,경위,형사,5,4,고의에 관한 설명으로 옳은 것은 모두 몇 개인가? (다툼이 있는 경우 판례에 의함),"가.부진정 부작위범의 고의는 반드시 구성요건적 결과발생에 대한 목적이나 계획적인 범행 의도가 있어야 하는 것은 아니고 법익침해의 결과발생을 방지할 법적 작위의무를 가지고 있는 사람이 의무를 이행함으로써 결과발생을 쉽게 방지할 수 있었음을 예견하고도 결과 발생을 용인하고 이를 방관한 채 의무를 이행하지 아니한다는 인식을 하면 족하다.나.임금 등 지급의무의 존부와 범위에 관하여 다툴 만한 근거가 있다면 사용자가 그 임금 등을 지급하지 않은 데에 상당한 이유가 있다고 보아야 하므로, 사용자에게 ｢근로기준법｣ 제109조 제1항, 제36조 위반의 고의가 있었다고 보기 어렵다.다.살인예비죄가 성립하기 위하여는 살인죄를 범할 목적 외에도 살인의 준비에 관한 고의가 있어야 한다.라.고의는 객관적 구성요건요소에 관한 인식과 구성요건실현을 위한 의사를 의미하고, ｢형법｣ 제13조에 의하면 고의가 인정되지 않은 경우 원칙적으로 처벌되지 않는다. ① 1개 ② 2개③ 3개 ④ 4개"
286,2024,경위,형사,6,3,정당방위에 관한 설명으로 옳은 것은 모두 몇 개인가? (다툼이 있는 경우 판례에 의함),"가.정당방위에서 ‘침해의 현재성’이란 침해행위가 형식적으로 기수에 이르렀는지에 따라 결정되는 것이 아니라 자기 또는 타인의 법익에 대한 침해상황이 종료되기 전까지를 의미한다.나.정당방위 상황을 이용할 목적으로 처음부터 공격자의 공격행위를 유발하는 의도적 도발의 경우라 하더라도 그 공격행위에 대해서는 방위행위를 인정할 수 있어 정당방위가 성립한다.다.피해자의 침해행위에 대하여 자기의 권리를 방위하기 위한 부득이한 행위가 아니고, 그 침해행위에서 벗어난 후 분을 풀려는 목적에서 나온 공격행위는 정당방위에 해당한다고 할 수 없다.라.정당방위의 성립요건으로서 방어행위는 순수한 수비적 방어뿐만 아니라 적극적 반격을 포함하는 반격방어의 형태도 포함되나, 그 방어행위는 자기 또는 타인의 법익침해를 방위하기 위한 행위로서 상당한 이유가 있어야 한다.① 1개 ② 2개③ 3개 ④ 4개"
287,2024,경위,형사,7,4,"책임의 근거와 본질에 관한 학설의 설명으로 옳고 그름의 표시(O, X)가 바르게 된 것은?","가. 책임은 자유의사를 가진 자가 그 의사에 의하여 적법한 행위를 할 수 있었음에도 불구하고 위법한 행위를 선택하였으므로 이에 대해 윤리적 비난을 가하는 것이다. – 심리적 책임론나.인간의 행위는 자유의사가 아니라 환경과 소질에 의해 결정되는 것으로 책임의 근거가 행위자의 반사회적 성격에 있다. – 규범적 책임론다.책임은 행위 당시 행위자가 가지고 있었던 고의･과실이라는 심리적 관계로 이해하여 심리적인 사실인 고의･과실이 있으면 책임이 있고, 그것이 없으면 책임도 없다. – 도의적 책임론라.책임을 심리적 사실관계로 보지 않고 규범적 평가 관계로 이해하여 행위자가 적법행위를 할 수 있었음에도 위법행위를 한 것에 대한 규범적 비난이 책임이다. – 사회적 책임론① 가(O), 나(O),다(O),라(O)② 가(O),나(X),다(O),라(X)③ 가(X),나(O),다(X),라(O)④ 가(X),나(X),다(X),라(X)"
