id,year,exam,subject,number,answer,question,data
382,2024,경위,경찰,22,4,경찰관의 직무수행 및 경찰장비의 사용과 관련한 재량의 범위 및 한계에 대한 설명으로 가장 적절하게 나열한 것은? (다툼이 있는 경우 판례에 의함),"불법적인 농성을 진압하는 방법 및 그 과정에서 어떤 경찰장비를 사용할 것인지는 (가. )인 상황과 예측되는 피해 발생의 ( 나. ) 위험성의 내용 등에 비추어 경찰관이 그 재량의 범위 내에서 정할 수 있다. 그러나 그 직무수행 중 특정한 경찰장비를 필요한 최소한의 범위를 넘어 관계 법령에서 정한 통상의 용법과 달리 사용함으로써 타인의 생명·신체에 위해를 가하였다면, 불법적인 농성의 진압을 위하여 그러한 방법으로라도 해당 경찰장비를 사용할 필요가 있고 그로 인하여 발생할 우려가 있는 타인의 생명·신체에 대한 위해의 정도가 ( 다. )으로 예견되는 범위 내에 있다는 등의 특별한 사정이 없는 한 그 직무수행은 위법하다고 보아야 한다. 나아가 경찰관이 농성진압의 과정에서 경찰장비를 위법하게 사용함으로써 그 직무수행이 적법한 범위를 벗어난 것으로 볼 수밖에 없다면, 상대방이 그로 인한 생명·신체에 대한 위해를 면하기 위하여 ( 라. )으로 대항하는 과정에서 그 경찰장비를 손상시켰더라도 이는 위법한 공무집행으로 인한 신체에 대한 현재의 부당한 침해에서 벗어나기 위한 행위로서 정당방위에 해당한다. 가. 나. 다. 라. ① 구체적 추상적 특수적 간접적 ② 추상적 구체적 통상적 직접적 ③ 구체적 추상적 통상적 직접적 ④ 구체적 구체적 통상적 직접적"
383,2024,경위,경찰,23,4,｢국가배상법｣상 경찰공무원의 배상책임에 대한 설명으로 가장 적절하지 않은 것은? (다툼이 있는 경우 판례에 의함),"① 경찰공무원이 공무를 수행하는 과정에서 위법행위로 타인에게 손해를 가한 경우에 국가 등이 손해배상책임을 지는 것 외에 그 개인은 고의 또는 중과실이 있는 경우에는 손해배상책임을 진다.② 경찰공무원의 중과실이란 공무원에게 통상 요구되는 정도의 상당한 주의를 하지 않더라도 약간의 주의를 한다면 손쉽게 위법·위해한 결과를 예견할 수 있는 경우임에도 만연히 이를 간과한 경우와 같이, 거의 고의에 가까운 현저한 주의를 결여한 상태를 의미한다.③ 경찰공무원이 직무를 수행함에 있어 경과실로 타인에게 손해를 입힌 경우에는 그로 인하여 발생한 손해에 대하여 경찰공무원 개인에게 배상책임을 부담시키지 아니하는 것은 공무원의 공무집행의 안정성을 확보하려는 데 있다.④ 국민의 생명·신체·재산 등을 보호하는 것을 본래의 사명으로 하는 국가는 형식적 의미의 법령에 근거가 없다면 경찰공무원에 대하여 위험을 배제할 작위의무를 인정할 수 없으므로, 경찰공무원의 부작위를 이유로 국가배상책임을 인정할 수 없다."
384,2024,경위,경찰,24,2,경찰작용에 대한 판례의 설명으로 가장 적절하지 않은 것은?,"① 경찰관이 구체적 상황에 비추어 인적 및 물적 능력의 범위 내에서 적절한 조치라는 판단에 따라 범죄의 진압 및 수사에 관한 직무를 수행한 경우에는 그러한 직무수행이 객관적 정당성을 상실하여 현저하게 불합리한 것으로 인정되지 않는 한 이를 위법하다고 할 수는 없다.② 본래 범의를 가지지 아니한 자에 대하여 수사기관이 사술이나 계략 등을 써서 범의를 유발케 하여 범죄인을 검거하는 함정수사는 위법함을 면할 수 없고, 범의를 가진 자에 대하여 단순히 범행의 기회를 제공하는 것에 불과한 경우라도 위법한 함정수사이다. ③ ｢경찰관 직무집행법｣ 제6조 제1항의 ‘경찰관의 제지에 관한 부분’은 범죄의 예방을 위한 경찰행정상 즉시강제, 즉 눈앞의 급박한 경찰상 장해를 제거하여야 할 필요가 있고 의무를 명할 시간적 여유가 없거나 의무를 명하는 방법으로는 그 목적을 달성하기 어려운 상황에서 의무불이행을 전제로 하지 않고 경찰이 직접 실력을 행사하여 경찰상 필요한 상태를 실현하는 권력적 사실행위에 관한 근거조항이다.④ 주거지에서 음악 소리를 크게 내거나 큰 소리로 떠들어 이웃을 시끄럽게 하는 행위는 ｢경범죄 처벌법｣ 제3조 제1항 제21호에서 경범죄로 정한 ‘인근소란 등’에 해당하고, 경찰관은 ｢경찰관 직무집행법｣에 따라 경범죄에 해당하는 행위를 예방·진압·수사하고, 필요한 경우 제지할 수 있다."
385,2024,경위,경찰,25,1,경찰작용에 있어서 행정소송에 대한 설명으로 가장 적절한 것은 모두 몇 개인가? (다툼이 있는 경우 판례에 의함),"가.관할 경찰청장은 운전면허와 관련된 처분권한을 각 경찰서장에게 위임하였고, 이에 따라 A경찰서장은 자신의 명의로 甲에게 운전면허정지처분을 하였다면, 甲의 운전면허정지처분 취소소송의 피고적격자는 A경찰서장이 아니라 관할 경찰청장이다.나.혈중알콜농도0.13%의 주취상태에서 차량을 운전하다가 적발된 乙에게 관할 경찰청장이 ｢도로교통법｣에 의거 운전면허취소처분을 하였을 경우, 乙은 행정심판을 거치지 않고 바로 행정소송을 제기할 수 있다.다.도로 외의 곳에서의 음주운전·음주측정거부 등에 대해서는 형사처벌도 가능하고 운전면허취소처분도 부과할 수 있다.라.경찰청장을 피고로 하여 취소소송을 제기하는 경우, 대법원 소재지를 관할하는 행정법원이 제1심 관할 법원으로 될 수 있다. ① 1개 ② 2개 ③ 3개 ④ 4개"
386,2024,경위,경찰,26,2,｢국가경찰과 자치경찰의 조직 및 운영에 관한 법률｣상 국가수사본부장 및 시·도자치경찰위원회에 대한 설명으로 적절하지 않은 것은 모두 몇 개인가?,"가.대학이나 공인된 연구기관에서 법률학·경찰학 분야에서 조교수 이상의 직이나 이에 상당하는 직에 10년 이상 있었던 사람은 국가수사본부장의 자격이 있다.나.국가수사본부장이 직무를 진행하면서 헌법이나 법률을 위배하였을 때에는 국회는 탄핵 소추를 의결할 수 있다.다.국가수사본부장의 임기는 2년으로 하며 중임할 수 없고, 임기가 끝나면 당연히 퇴직한다.라.시·도자치경찰위원회는 위원장 1명을 포함한 7명의 위원으로 구성하되, 위원장은 상임으로 하고, 나머지 위원은 비상임으로 한다.마.시·도자치경찰위원회 위원은 시·도의회가 추천하는 2명, 국가경찰위원회가 추천하는 2명, 해당 시·도 교육감이 추천하는 1명, 시·도자치경찰위원회 위원추천위원회가 추천하는 1명, 시·도지사가 지명하는 1명을 시·도지사가 임명한다.바.대학이나 공인된 연구기관에서 법률학·행정학 또는 경찰학 분야의 조교수 이상의 직이나 이에 상당하는 직에 5년 이상 있었던 사람은 시·도자치경찰위원회 위원의 자격이 있다. ① 1개 ② 2개 ③ 3개 ④ 4개"
387,2024,경위,경찰,27,4,｢경찰공무원법｣에 대한 설명으로 가장 적절한 것은?,"① 경정 이하의 경찰공무원을 신규 채용할 때에는 1년간 시보로 임용하고, 그 기간이 만료된 날에 정규 경찰공무원으로 임용한다. ② 경찰공무원의 복제에 관한 사항은 대통령령으로 정한다. ③ 임용권자는 경찰공무원이 해당 경과에서 직무를 수행하는 데 필요한 자격증의 효력이 상실되거나 면허가 취소되어 담당 직무를 수행할 수 없게 되었을 때에는 직권으로 면직시킬 수 있으며, 이 경우에는 징계위원회의 동의를 받아야 한다.④ 징계처분, 휴직처분, 면직처분, 그 밖에 의사에 반하여 불리한 처분에 대한 행정소송은 경찰청장을 피고로 하는 것이 원칙이며, 예외도 있다."
388,2024,경위,경찰,28,2,｢경찰공무원 징계령｣상 징계위원회의 회의에 대한 설명으로 가장 적절하지 않은 것은?,"① 징계위원회의 회의는 위원장과 징계위원회가 설치된 경찰기관의 장이 회의마다 지정하는 4명 이상 6명 이하의 위원으로 성별을 고려하여 구성하되, 민간위원의 수는 위원장을 포함한 위원 수의 2분의1 이상이어야 한다.② 징계사유가 ｢성폭력범죄의 처벌 등에 관한 특례법｣에 따른 성폭력범죄, ｢양성평등기본법｣에 따른 성희롱에 해당하는 징계 사건이 속한 징계위원회의 회의를 구성하는 경우에는 피해자와 같은 성별의 위원이 위원장을 포함한 위원 수의 3분의1 이상 포함되어야 한다.③ 위원장이 부득이한 사유로 직무를 수행할 수 없거나 위원장이 필요하다고 인정하는 경우에는 출석한 위원 중 최상위 계급 또는 이에 상응하는 직급에 있거나 최상위 계급 또는 이에 상응하는 직급에 먼저 승진임용된 공무원이 위원장이 된다.④ 징계위원회의 위원장은 위원회의 사무를 총괄하며 위원회를 대표하고, 표결권을 가진다."
389,2024,경위,경찰,29,2,정책결정 모델과 그에 대한 설명으로 가장 적절한 것은?,"① 엘리트 모델에 의하면 정책결정자는 고도의 합리성을 기반으로 최선의 대안을 결정한다. ② 사이버네틱스 모델은 설정된 목표를 달성하기 위해 정보분석과 환류과정을 통해 자신의 행동을 스스로 조정해 나간다고 가정한다. ③ 혼합탐사 모델은 합리모델의 비현실성과 점증모델의 보수성을 극복하기 위한 모델로 기존의 정책을 바탕으로 이루어지는 점증주의 성향을 비판하면서, 새로운 정책을 내릴 때마다 정책방향도 다시 검토할 것을 주장한다. ④ 관료정치 모델에 의하면 정책결정시 정치적 합리성을 기반으로 기존 정책의 문제점을 부분적으로 수정하거나 약간의 향상을 가져오는 결정을 한다."
390,2024,경위,경찰,30,4,경찰조직의 편성원리에 대한 설명으로 가장 적절하지 않은 것은?,① 계층제의 원리 - 권한 및 책임 한계가 명확하며 경찰행정의 능률성과 조직의 안정성을 확보할 수 있다.② 분업의 원리 - 업무의 전문화를 통해 업무습득에 걸리는 시간을 단축할 수 있지만 분업의 정도가 높아질수록 조직할거주의가 초래될 수 있다. ③ 명령통일의 원리 - 업무수행의 혼선을 방지하여 신속한 의사결정을 하도록 한다.④ 통솔범위의 원리 - 업무의 종류가 단순할수록 통솔범위는 좁아지며 계층의 수가 많을수록 통솔범위는 넓어진다.
391,2024,경위,경찰,31,2,"직업공무원제도에 대한 설명이다. 아래 가.부터 라.까지 설명 중 옳고 그름의 표시(O, X)가 바르게 된 것은?","가.직업공무원제도는 신분보장, 정치적 중립, 자격이나 능력중시, 개방형 인력충원 방식의 선호라는 점에서 실적주의와 공통점을 가진다. 나.직업공무원제도의 성공적 정착을 위해서는 공직에 대한 사회의 높은 평가가 필요하며 퇴직 후의 불안해소와 생계보장을 위해 적절한 연금제도가 확립되어야 한다. 다.직업공무원제도는 장기적인 발전가능성을 선발기준으로 삼고 있으며 직위분류제가 계급제보다 직업공무원제도의 정착에 더 유리하다.라.직업공무원제도는 행정의 안정성과 독립성 확보에 용이하며 외부환경 변화에 신속하게 대응한다는 장점이 있다. ① 가.(O), 나.(O), 다.(O), 라.(X)② 가.(X), 나.(O), 다.(X), 라.(X)③ 가.(O), 나.(O), 다.(X), 라.(O)④ 가.(X), 나.(O), 다.(O), 라.(X)"
392,2024,경위,경찰,32,1,｢국가재정법｣에 대한 설명으로 적절한 것은 모두 몇 개인가?,가.기획재정부장관은 국무회의의 심의를 거쳐 대통령의 승인을 얻은 다음 연도의 예산안편성지침을 매년 1월 31일까지 각 중앙관서의 장에게 통보하여야 한다. 나.각 중앙관서의 장은 예산의 목적범위 안에서 재원의 효율적 활용을 위하여 대통령령으로 정하는 바에 따라 국무회의의 심의를 거친 후 대통령의 승인을 얻어 각 세항 또는 목의 금액을 전용할 수 있다. 다.각 중앙관서의 장은 ｢국가회계법｣에서 정하는 바에 따라 회계연도마다 작성한 결산보고서를 다음 연도 2월 말일까지 기획재정부장관에게 제출하여야 한다. 라.기획재정부장관은 ｢국가회계법｣에서 정하는 바에 따라 회계연도마다 작성하여 대통령의 승인을 받은 국가결산보고서를 다음 연도 5월 20일까지 감사원에 제출하여야 한다. ① 1개 ② 2개 ③ 3개 ④ 4개
393,2024,경위,경찰,33,1,｢경찰장비관리규칙｣상 무기류관리에 대한 설명으로 가장 적절하지 않은 것은?,"① 경찰기관의 장은 무기를 휴대한 자 중에서 직무상의 비위 등으로 인하여 징계대상이 된 자, 형사사건의 조사의 대상이 된 자, 경찰공무원 직무적성검사 결과 고위험군에 해당되는 자가 발생한 때에는 즉시 대여한 무기･탄약을 회수하여야 한다. ② 간이무기고는 근무자가 24시간 상주하는 지구대, 파출소, 상황실 및 112타격대 등 경찰기관의 장이 필요하다고 인정하는 상당한 이유가 있는 장소에 설치할 수 있다. ③ 탄약고 내에는 전기시설을 하여서는 아니되며, 조명은 건전지 등으로 하고 방화시설을 완비하여야 한다. 단, 방폭설비를 갖춘 경우 전기시설을 설치할 수 있다.④ 지구대 등의 간이무기고의 경우는 소속 경찰관에 한하여 무기를 지급하되 감독자 입회(감독자가 없을 경우 반드시 타 선임 경찰관 입회)하에 무기탄약 입출고부에 기재한 뒤 입출고하여야 한다. 다만, 긴급상황 발생시 경찰서장의 사전허가를 받은 경우의 대여는 예외로 한다."
394,2024,경위,경찰,34,1,다음 학자와 그가 주장하는 이론에 대한 설명으로 적절한 것은 모두 몇 개인가?,"가.맥클리랜드(McClelland) - 개인마다 욕구의 계층은 차이가 있다고 보았으며 인간의 욕구를 성취 욕구, 자아실현 욕구, 권력 욕구로 구분하였다. 나.허즈버그(Herzberg) - 주어진 일에 대한 성취감, 주변의 인정, 승진 가능성 등은 동기(만족)요인으로, 열악한 근무환경, 낮은 보수 등은 위생요인으로 구분하였으며 두 요인은 상호 독립되어 있다고 보았다. 다.맥그리거(McGregor) - 인간의 욕구는 5단계의 계층으로 이루어지며 하위 욕구부터 상위 욕구로 발달한다고 보았다. 라.앨더퍼(Alderfer) - 인간의 욕구를 계층화하여 생존(Existence) 욕구, 존경(Respect) 욕구, 성장(Growth) 욕구의 3단계로 구분하였다. ① 1개 ② 2개③ 3개 ④ 4개"
395,2024,경위,경찰,35,3,｢지역경찰의 조직 및 운영에 관한 규칙｣상 경찰서장이 정하는 사항으로 적절한 것은 모두 몇 개인가?,가.치안센터 관할구역의 크기 나.순찰팀의 수다.치안센터 전담근무자의 근무형태 및 근무시간라.관리팀 및 순찰팀의 인원 ① 1개 ② 2개 ③ 3개 ④ 4개
396,2024,경위,경찰,36,4,｢아동학대범죄의 처벌 등에 관한 특례법｣에 대한 설명으로 가장 적절한 것은?,"① 피해아동에게 고소할 법정대리인이나 친족이 없는 경우에 이해관계인이 신청하면 검사는 20일 이내에 고소할 수 있는 사람을 지정하여야 한다.② 아동학대범죄 신고를 접수한 사법경찰관리는 아동학대범죄가 행하여지고 있는 것으로 신고된 현장 또는 피해아동을 보호하기 위하여 필요한 장소에 출입하여 아동 또는 아동학대행위자 등 관계인에 대하여 조사를 하거나 질문을 할 수 있다. 이 경우 사법경찰관리는 피해아동의 보호 및 「아동복지법」 제22조의4의 사례관리계획에 따른 사례관리를 위한 범위에서만 아동학대행위자 등 관계인에 대하여 조사해야 한다. ③ 법원은 아동학대행위자에 대하여 유죄판결(선고유예를 포함한다)을 선고하면서 200시간의 범위에서 재범예방에 필요한 수강명령 또는 아동학대 치료프로그램의 이수명령을 병과할 수 있다.④ 사법경찰관은 아동학대행위자에 대한 긴급임시조치를 한 경우에는 즉시 긴급임시조치결정서를 작성하여야 하고, 그 내용을 시·도지사 또는 시장·군수·구청장에게 지체 없이 통지하여야 한다."
397,2024,경위,경찰,37,3,｢스토킹범죄의 처벌 등에 관한 법률｣상 잠정조치로 적절한 것은 모두 몇 개인가?,"가.국가경찰관서의 유치장 또는 구치소에의 유치나.스토킹행위자와 피해자 등의 분리 및 범죄수사다.피해자 또는 그의 동거인, 가족이나 그 주거 등으로부터 100미터 이내의 접근 금지라.스토킹 피해 관련 상담소 또는 보호시설로의 피해자 등 인도(피해자 등이 동의한 경우만 해당한다)마.피해자 또는 그의 동거인, 가족에 대한 ｢전기통신기본법｣ 제2조 제1호의 전기통신을 이용한 접근 금지 ① 1개 ② 2개 ③ 3개 ④ 4개"
398,2024,경위,경찰,38,2,｢재난 및 안전관리 기본법｣에 대한 설명으로 가장 적절한 것은?,"① 재난관리란 재난이나 그 밖의 각종 사고로부터 사람의 생명·신체 및 재산의 안전을 확보하기 위하여 하는 모든 활동을 말한다.② 시장·군수·구청장과 지역통제단장(대통령령으로 정하는 권한을 행사하는 경우에만 해당한다)은 재난이 발생하거나 발생할 우려가 있는 경우에 사람의 생명 또는 신체나 재산에 대한 위해를 방지하기 위하여 필요하면 해당 지역 주민이나 그 지역 안에 있는 사람에게 대피하도록 명하거나 선박·자동차 등을 그 소유자·관리자 또는 점유자에게 대피시킬 것을 명할 수 있다. 이 경우 미리 대피장소를 지정할 수 있다. ③ 긴급구조기관이란 경찰청, 시·도경찰청 및 경찰서를 말한다. 다만, 해양에서 발생한 재난의 경우에는 해양경찰청·지방해양경찰청 및 해양경찰서를 말한다.④ 국무총리는 대통령령으로 정하는 재난이 발생하거나 발생할 우려가 있는 경우 사람의 생명·신체 및 재산에 미치는 중대한 영향이나 피해를 줄이기 위하여 긴급한 조치가 필요하다고 인정하면 중앙안전관리위원회의 심의를 거쳐 재난사태를 선포할 수 있다. 다만, 국무총리는 재난상황이 긴급하여 중앙안전관리위원회의 심의를 거칠 시간적 여유가 없다고 인정하는 경우에는 중앙안전관리위원회의 심의를 거치지 아니하고 재난사태를 선포할 수 있다."
399,2024,경위,경찰,39,3,｢국가보안법｣에 대한 설명으로 적절하지 않은 것은 모두 몇 개인가?,"가.반국가단체라 함은 정부를 참칭하거나 국가를 변란할 것을 목적으로 하는 국내외의 결사 또는 집단으로서 지휘통솔체제를 갖춘 단체를 말한다. 나.반국가단체의 구성·가입죄 및 가입권유죄는 미수뿐만 아니라 예비·음모도 처벌한다. 다.범죄수사 또는 정보의 직무에 종사하는 공무원이 이 법의 죄를 범한 자라는 정을 알면서 그 직무를 유기한 때에는 10년 이하의 징역에 처한다. 다만, 본범과 친족관계가 있는 때에는 그 형을 감경 또는 면제한다.라.반국가단체나 그 구성원의 지령을 받거나 받기 위하여 또는 그 목적수행을 협의하거나 협의하기 위하여 잠입하거나 탈출한 자는 10년 이하의 징역에 처한다. ① 1개 ② 2개 ③ 3개 ④ 4개"
400,2024,경위,경찰,40,4,｢경찰 비상업무 규칙｣에 대한 설명으로 가장 적절한 것은?,"① 필수요원이라 함은 전 경찰공무원 및 일반직공무원 중 경찰기관의 장이 지정한 자로 비상소집 시 2시간 이내에 응소하여야 할 자를 말한다.② 비상근무는 비상상황의 유형에 따라 경비소관의 경비, 작전비상, 수사소관의 수사비상, 안보소관의 안보비상, 치안상황소관의 교통, 재난비상으로 구분하여 발령한다. ③ 경계강화 발령시 별도의 경력동원 없이 특정분야의 근무를 강화하며 지휘관과 참모는 정위치 근무를 원칙으로 한다. ④ 비상근무의 발령권자는 비상상황이 발생하여 비상근무를 실시하고자 할 경우에는 비상근무의 목적, 지역, 기간 및 동원대상 등을 특정하여 별지 제1호 서식의 비상근무발령서에 의하여 비상근무를 발령한다."
401,2024,경위,범죄,1,4,공식범죄통계에 대한 설명으로 가장 적절한 것은?,"① 범죄율은 일정 기간(통상 1년) 동안 특정 지역에서 인구 1,000명당 발생한 범죄 건수를 나타낸다.② 총 인구가 2022년 20만 명에서 2023년 15만 명으로 감소한 인구소멸 지역인 A시에서 동 기간 범죄건수가 2,000건에서 1,000건으로 줄었다면 범죄율이 50% 감소한 것이다.③ 우리나라의 공식 범죄통계 중 경찰청 ｢범죄통계｣와 검찰청 ｢범죄분석｣의 범죄발생 건수는 동일하다.④ 우리나라 경찰의 검거율은 100%를 초과하여 달성되는 경우도 종종 발생한다."
402,2024,경위,범죄,2,1,다음은 범죄학 연구방법에 관한 내용이다. 가장 적절한 것은?,"가.특정 지역에 거주하며 공통된 특성을 공유하고 있는 집단을 대상으로 상당 시간 동안 관찰하여 수행하는 것이다. 나.대부분의 연구방법들은 시계열적 분석이 미흡하고, 범죄경력의 진전 과정이나 범죄율 증감 과정에 대한 분석이 간과되기 쉽다는 단점을 보완하기 위해 고안되었다. 다.시간의 흐름에 따라 범죄율이 증감되는 과정의 관찰이 가능하다는 장점이 있으나, 대상자의 자료 수집에 큰 비용과 시간이 소요된다.① 코호트연구 (Cohort Research)② 참여관찰연구 (Participant Observation)③ 데이터 마이닝 (Data Mining)④ 실험연구 (Experimental Study)"
403,2024,경위,범죄,3,2,암수범죄에 관한 내용으로 가장 적절하지 않은 것은?,"① 암수범죄란 실제로 범죄가 발생하였으나 공식적인 통계에는 나타나지 않은 범죄를 말한다.② 절대적 암수범죄란 수사기관에 의하여 인지되었으나 해결되지 못하여 범죄통계에 반영되지 못한 범죄를 말한다. ③ 공식범죄통계가 갖는 암수범죄의 문제를 극복하기 위해 자기보고식조사나 피해자조사를 활용하기도 한다.④ 서덜랜드(Sutherland)는 범죄와 비행에 대한 통계에는 암수가 존재하며, 암수는 가변적이므로 모든 사회통계 중에서 가장 신빙성이 없고 난해한 것이라고 하였다."
404,2024,경위,범죄,4,1,범죄학의 발전과정을 시간 순서대로 나열한 것 중 가장 적절한 것은?,㉠계몽주의와 고전학파㉡도시생태와 시카고학파㉢과학적 탐구와 실증학파㉣신고전주의 범죄학㉤비판주의 범죄학 ① ㉠-㉢-㉡-㉤-㉣ ② ㉢-㉠-㉡-㉤-㉣③ ㉠-㉢-㉡-㉣-㉤ ④ ㉠-㉢-㉤-㉡-㉣
405,2024,경위,범죄,5,2,다음은 고전주의와 실증주의 범죄학파의 견해를 기술한 것이다. 실증주의 학파의 내용만으로 바르게 짝지어진 것은?,"㉠ 인본주의 철학사상을 배경으로 한다. ㉡ 인간은 환경의 영향을 받는 존재이다.㉢ 과학적 연구방법을 중시한다. ㉣ 형벌의 본질은 응보이며, 형벌의 목적은 일반예방이다. ㉤ 형벌은 개인의 특성에 따라 차별적으로 결정되어야 한다. ㉥ 인간은 자유의지를 가진 합리적이고 이성적인 존재이다. ① ㉠,㉡,㉢ ② ㉡,㉢,㉤③ ㉢,㉣,㉤ ④ ㉣,㉤,㉥"
