id,year,exam,subject,number,answer,question,data
106,2023,경위,경찰,26,1,청원경찰에 대한 설명으로 적절한 것은 모두 몇 개인가? (다툼이 있는 경우 판례에 따름),가.시·도경찰청장은 청원경찰 배치가 필요하다고 인정하는 기관의 장 또는 시설사업장의 경영자에게 청원경찰을 배치할 것을 명령할 수 있다.나.청원경찰이 직무상의 의무 등을 위반하는 경우에는 청원주 및 관할 감독 경찰서장은 대통령령이 정하는 징계절차를 거쳐 징계처분을 하여야 한다.다.청원경찰은 ｢형법｣이나 그 밖의 법령에 따른 벌칙을 적용할 때에는 공무원으로 보기 때문에 청원경찰의 불법행위에 대한 배상책임에 관하여는 ｢국가배상법｣의 규정을 적용한다.라. 국가나 지방자치단체에 근무하는 청원경찰의 근무관계는 사법상의 고용계약관계이다. ① 0개 ② 1개 ③ 2개 ④ 3개
107,2023,경위,경찰,27,3,"경찰법의 법원(法源)에 관한 설명이다. 아래 가.부터 라.까지 설명 중 옳고 그름의 표시(O, X)가 바르게 된 것은?","가.헌법은 국가의 기본적인 통치구조를 정한 기본법으로서 행정의 조직이나 작용의 기본원칙을 정한 부분은 그 한도 내에서 경찰법의 법원이 된다. 나.경찰권 발동은 법률에 근거해야 하므로, 법률은 경찰법상의 법률관계에 있어서 중요한 법원이다. 다.불문법원으로서 일반적으로 정의에 합치되는 보편적 원리로서 인정되고 있는 모든 원칙을 조리라 하고, 경찰관청의 행위가 형식상 적법하면 조리에 위반하더라도 위법이 될 수 없다.라.경찰법의 법원은 일반적으로 성문법원과 불문법원으로 나눌 수 있으며 헌법, 법률, 조약과 국제법규, 규칙은 성문법원이다. ① 가.(O) 나.(X) 다.(X) 라.(O) ② 가.(O) 나.(O) 다.(X) 라.(X) ③ 가.(O) 나.(O) 다.(X) 라.(O) ④ 가.(X) 나.(O) 다.(X) 라.(O)"
108,2023,경위,경찰,28,3,다음 상황에 대한 설명으로 가장 적절하지 않은 것은?,"A는 자신이 운영하는 옷가게에서 여자모델 B에게 수영복만을 입게 하여 쇼윈도우에 서 있도록 하였다. 지나가던 사람들이 이를 구경하기 위해 쇼윈도우 앞에 몰려들어 도로교통상의 심각한 장해가 발생하였다. ① 조건설에 의하면 군중, A, B 모두 경찰책임자가 된다. ② 의도적 간접원인제공자이론(목적적 원인제공자책임설)을 인정한다면 A에게 경찰권을 발동하여 A로 하여금 B를 쇼윈도우에서 나가도록 하라고 할 수 있다. ③ 직접원인설에 의할 때 경찰책임자는 B이다. ④ 교통장해가 그다지 중대하지 않다면 A를 경찰책임자로 보아서는 안 될 것이다."
109,2023,경위,경찰,29,4,경찰책임에 대한 설명으로 가장 적절하지 않은 것은?,"① 형사미성년자도 행위책임의 주체가 될 수 있다. ② 행위자의 고의나 과실에 무관하게 행위책임을 진다. ③ 행위자의 작위나 부작위에 상관없이 위험을 야기시키면 행위책임을 진다. ④ 경찰책임자에 대한 경찰의 경찰권발동으로 경찰책임자에게 재산적 손해가 발생한 경우, 그 경찰책임자에게 손실보상청구권이 인정된다."
110,2023,경위,경찰,30,2,경찰상 긴급상태(경찰비책임자에 대한 경찰권발동)에 대한 설명으로 가장 적절하지 않은 것은?,"① 위험이 이미 현실화되었거나 위험의 현실화가 목전에 급박하여야 한다. ② 경찰상 긴급상태에 대한 일반적 근거는 ｢경찰관 직무집행법｣에 규정되어 있다. ③ 경찰비책임자에 대한 경찰권발동을 위해서 보충성은 전제조건이므로 경찰책임자에 대한 경찰권발동 또는 경찰 자신의 고유한 수단으로는 위험방지가 불가능한지 여부를 먼저 심사하여야 한다. ④ 경찰권발동으로 인하여 손실을 입은 경찰비책임자에게는 정당한 보상이 행해져야 하며, 결과제거청구와 같은 구제수단이 마련되어야 한다."
111,2023,경위,경찰,31,2,｢국가경찰 및 자치경찰의 조직 및 운영에 관한 법률｣상 비상사태 등 전국적 치안유지에 대한 설명으로 가장 적절하지 않은 것은?,"① 경찰청장은 비상사태 등 전국적 치안유지를 위한 지휘ㆍ명령이 필요한 경우에는 시ㆍ도자치경찰위원회에 자치경찰사무를 담당하는 경찰공무원을 직접 지휘ㆍ명령하려는 사유 및 내용 등을 구체적으로 제시하여 통보하여야 한다.② 경찰청장이 비상사태 등 전국적 치안유지를 위한 지휘ㆍ명령을 하는 경우에는 국가경찰위원회에 즉시 보고하여야 하지만, 국민안전에 중대한 영향을 미치는 사안에 대하여 다수의 시ㆍ도에 동일하게 적용되는 치안정책을 시행할 필요가 있다고 인정할 만한 충분한 사유가 있는 경우에는 미리 국가경찰위원회의 의결을 거쳐야 하며 긴급한 경우에는 우선 조치 후 지체 없이 국가경찰위원회의 의결을 거쳐야 한다.③ 경찰청장은 비상사태 등 전국적 치안유지를 위한 지휘ㆍ명령할 수 있는 사유가 해소된 때에는 경찰공무원에 대한 지휘ㆍ명령을 즉시 중단하여야 한다. ④ 시ㆍ도자치경찰위원회는 자치경찰사무와 관련하여 해당 시ㆍ도의 경찰력으로는 국민의 생명ㆍ신체ㆍ재산의 보호 및 공공의 안녕과 질서유지가 어려워 경찰청장의 지원ㆍ조정이 필요하다고 인정할 만한 충분한 사유가 있는 경우 의결로 지원ㆍ조정의 범위ㆍ기간 등을 정하여 경찰청장에게 지원ㆍ조정을 요청할 수 있다."
112,2023,경위,경찰,32,2,｢국가경찰과 자치경찰의 조직 및 운영에 관한 법률｣상 자치경찰사무에 대한 설명으로 가장 적절하지 않은 것은?,"① 국가는 지방자치단체가 이관받은 사무를 원활히 수행할 수 있도록 인력, 장비 등에 소요되는 비용에 대하여 재정적 지원을 하여야 한다. ② 자치경찰사무의 수행에 필요한 예산은 관할 시․도경찰청장의 의견을 들어 시·도자치경찰위원회의 심의·의결을 거쳐 시·도지사가 수립한다. ③ 시·도지사는 자치경찰사무 담당 공무원에게 조례에서 정하는 예산의 범위에서 재정적 지원 등을 할 수 있다. ④ 시·도의회는 관련 예산의 효율적인 관리를 위하여 의결로써 자치경찰사무에 대해 시·도자치경찰위원장의 출석 및 자료 제출을 요구할 수 있다."
113,2023,경위,경찰,33,2,｢국가경찰과 자치경찰의 조직과 운영에 관한 법률｣상 국가경찰위원회에 대한 설명으로 적절한 것은 모두 몇 개인가?,"가.국가경찰위원회는 위원장 1명을 포함한 7명의 위원으로 구성하되, 위원장은 당연직 상임이며, 5명의 위원은 비상임으로 하고, 1명의 위원은 상임으로 한다.나.위원의 임기는 3년으로 하며, 연임할 수 있다. 이 경우 보궐위원의 임기는 전임자 임기의 남은 기간으로 한다.다.국가경찰위원회의 사무는 자체에서 수행한다.라.국가경찰위원회의 회의는 재적위원 과반수의 출석과 출석위원 과반수의 찬성으로 의결한다. ① 0개 ② 1개 ③ 2개 ④ 3개"
114,2023,경위,경찰,34,2,｢경찰공무원법｣에 대한 설명으로 가장 적절하지 않은 것은?,"① 경위 이하의 경찰공무원으로서 모든 경찰공무원의 귀감이 되는 공을 세우고 전사하거나 순직한 사람에 대하여는 2계급 특별승진 시킬 수 있다. ② 경찰청장은 전시·사변이나 그 밖에 이에 준하는 비상사태에서는 2년의 범위에서 동법에 따른 계급정년을 연장할 수 있고, 이 경우 총경 이상의 경찰공무원에 대하여는 행정안전부장관과 국무총리를 거쳐 대통령의 승인을 받아야 한다. ③ 경찰청 소속 경무관 이상의 강등 및 정직과 경정 이상의 파면 및 해임은 경찰청장의 제청으로 행정안전부장관과 국무총리를 거쳐 대통령이 한다. ④ 경무관 이상의 경찰공무원에 대한 징계의결은 ｢국가공무원법｣에 따라 국무총리 소속으로 설치된 징계위원회에서 한다."
115,2023,경위,경찰,35,3,｢경찰공무원 임용령｣상 임용시기에 대한 설명으로 가장 적절하지 않은 것은?,"① 경찰공무원은 임용장이나 임용통지서에 적힌 날짜에 임용된 것으로 보며, 임용일자를 원칙적으로 소급할 수 없다. ② 경찰공무원의 사망으로 인한 면직은 사망한 다음 날에 면직된 것으로 본다.  ③ 경찰공무원이 재직 중 전사하거나 순직한 경우로서 특별승진 임용하는 경우에는 사망한 날을 임용일자로 본다. ④ 경찰공무원이 형사사건으로 기소되어 직위해제하는 경우에는 기소된 날을 임용일자로 본다."
116,2023,경위,경찰,36,2,｢경찰관 직무집행법｣상 불심검문에 대한 설명으로 적절한 것은 모두 몇 개인가? (다툼이 있는 경우 판례에 따름),"가.경찰관은 동행한 사람의 가족이나 친지 등에게 동행한 경찰관의 신분, 동행 장소, 동행 목적과 이유를 알리거나 다른 사람으로 하여금 즉시 연락할 수 있는 기회를 주어야 하며, 변호인의 도움을 받을 권리가 있음을 알려야 한다.나.검문하는 사람이 경찰관이고 검문하는 이유가 범죄행위에 관한 것임을 충분히 알고 있었다고 보이는 경우에 신분증을 제시하지 않았다 하더라도 그 불심검문을 위법한 공무집행이라고 할 수 없다.다.경찰관은 불심검문시 그 장소에서 질문을 하는 것이 그 사람에게 불리하거나 교통에 방해가 된다고 인정될 때에는 질문을 하기 위하여 가까운 경찰청·경찰서·지구대·파출소 또는 출장소(해양경찰관서 미포함)로 동행할 것을 요구할 수 있다. 이 경우 동행을 요구받은 사람은 그 요구를 거절할 수 있다. 라.경찰관은 질문을 하거나 동행을 요구할 경우 자신의 신분을 표시하는 증표를 제시하면서 소속과 성명을 밝히고 질문이나 동행의 목적과 이유를 설명할 수 있으며, 동행을 요구하는 경우에는 동행 장소를 밝힐 수 있다. ① 0개 ② 1개 ③ 2개 ④ 3개"
117,2023,경위,경찰,37,4,｢경찰관 직무집행법｣상 보호조치에 대한 설명으로 적절하지 않은 것만을 모두 고른 것은?,"가. 경찰관은 적당한 보호자가 없는 부상자에 대해 응급구호가 필요하다고 인정할 만한 사유가 있다면 본인이 구호를 거절하더라도 보호조치를 할 수 있다.나. 경찰관은 보호조치를 하였을 때에는 지체 없이 구호대상자의 가족, 친지 또는 그 밖의 연고자에게 그 사실을 알려야 하며, 연고자가 발견되지 아니할 때에는 구호대상자를 적당한 공공보건의료기관이나 공공구호기관에 즉시 인계할 수 있다.다. 경찰관이 구호대상자를 공공보건의료기관이나 공공구호기관에 인계하였을 때에는 해당 경찰관이 즉시 그 사실을 해당 공공보건의료기관 또는 공공구호기관의 장 및 그 감독행정청에 통보하여야 한다.라. 경찰관은 구호대상자를 발견하였을 때 보건의료기관이나 공공구호기관에 긴급구호를 요청할 수 있고, 긴급구호를 요청받은 기관이 정당한 이유없이 이를 거절하는 경우 ｢경찰관 직무집행법｣에 따라 처벌하도록 규정되어 있다. ① 가. 나. ② 나. 다. ③ 나. 다. 라. ④ 가. 나. 다. 라."
118,2023,경위,경찰,38,2,｢경찰관 직무집행법｣상 경찰장비에 대한 설명으로 적절한 것은 모두 몇 개인가?,"가. 경찰관은 현행범이나 사형·무기 또는 장기 3년 이상의 징역이나 금고에 해당하는 죄를 범한 범인의 체포 또는 도주 방지의 직무를 수행하기 위하여 필요하다고 인정되는 상당한 이유가 있을 때에는 그 사태를 합리적으로 판단하여 필요한 한도에서 경찰장구를 사용할 수 있다.나. 경찰관은 직무수행 중 경찰장비를 사용할 수 있다. 다만, 재산의 침해 또는 생명이나 신체에 위해를 끼칠 수 있는 경찰장비를 긴급하게 사용할 때에는 안전검사 없이 안전교육을 받은 후 사용할 수 있다. 다. 위해성 경찰장비는 필요한 최소한도에서 사용하여야 하며, 위해성 경찰장비의 종류 및 그 사용기준, 안전교육·안전검사의 기준 등은 행정안전부령으로 정한다.라. 경찰청장은 위해성 경찰장비를 새로 도입하려는 경우에는 대통령령으로 정하는 바에 따라 안전교육을 실시하여 그 안전교육의 결과보고서를 국회 소관 상임위원회에 제출하여야 한다. 이 경우 안전교육에는 외부 전문가를 참여시킬 수 있다. ① 0개 ② 1개 ③ 2개 ④ 3개"
119,2023,경위,경찰,39,4,경찰의무의 이행확보수단에 대한 설명으로 가장 적절한 것은?,"① 형사처벌과 이행강제금을 병과하는 것은 헌법상의 이중처벌금지의 원칙에 위반된다. ② 경찰상의 강제집행의 실정법적 근거로는 ｢경찰관 직무집행법｣이 유일하다. ③ 즉시강제는 경찰상의 이행을 확보하기 위한 가장 효과적인 수단이며, 공공의 안녕 또는 질서에 대한 급박한 위해가 존재하는 경우에는 국가는 그 위해를 제거하여 공공의 안녕과 질서를 유지할 자연법적 권리와 의무를 가지므로, 특별한 법률적 근거가 없다 하더라도 경찰상의 즉시강제가 가능하다. ④ 경찰상의 강제집행을 하기 위해서는 경찰의무를 부과하는 경찰하명의 근거가 되는 법률 이외에 경찰상의 강제집행을 위한 별도의 법적 근거가 있어야 한다."
120,2023,경위,경찰,40,4,｢국가배상법｣에 대한 설명으로 적절한 것은 모두 몇 개인가? (다툼이 있는 경우 판례에 따름),가. 경찰관들의 시위진압에 대항하여 시위자들이 던진 화염병에 의하여 발생한 화재로 인하여 손해를 입은 주민이 국가를 상대로 국가배상을 청구한 경우에는 국가의 배상책임이 인정되지 않는다. 나. 시위진압 과정에서 가해공무원인 전투경찰이 특정되지 않더라도 손해배상책임이 인정된다. 다. 전투경찰순경은 ｢국가배상법｣ 제2조 제1항 단서에 따라 손해배상청구가 제한되는 군인·군무원·경찰공무원 또는 예비군대원에 해당한다. 라. 경찰공무원이 전투·훈련 등 직무집행과 관련하여 순직한 경우에는 전투·훈련 또는 이에 준하는 직무집행뿐만 아니라 일반 직무집행에 관하여도 국가나 지방자치단체의 배상책임이 제한된다. 마. ｢국가배상법｣ 제5조에 따라 도로나 하천은 물론 경찰견도 영조물에 포함된다. ① 2개 ② 3개 ③ 4개 ④ 5개
121,2023,경위,범죄,1,2,"어떠한 이론이 범죄 또는 형사사법에 관해 적절하게 설명하는지 알기 위해서는 이론들을 특정한 기준에 의해 평가할 필요가 있다. 다음 중, 에이커스(Akers)와 셀러스(Sellers)가 제시한 범죄학 이론 평가의 기준으로 가장 거리가 먼 것은?",① 검증 가능성 ② 시대적 대응성 ③ 경험적 타당성 ④ 정책적 함의
122,2023,경위,범죄,2,2,범죄학의 연구방법에 대한 다음 설명 중 가장 적절하지 않은 것은?,① 설문조사를 통한 연구는 두 변수 사이의 관계를 넘어서는 다변량 관계를 살펴볼 수 있다는 장점이 있다. ② 양적연구는 질적연구에 비해 연구결과의 외적 타당성을 확보하기 어렵다는 단점이 있다. ③ 실험연구는 연구자가 필요한 조건을 통제함으로써 내적 타당성을 확보하기에 용이하다. ④ 설문조사를 통한 연구는 부정확한 응답의 가능성에 대한 고려가 필요하다.
123,2023,경위,범죄,3,4,실증주의 범죄학파의 기본입장에 대한 설명으로 가장 적절한 것은?,"① 인간을 자유로운 의사에 따라 합리적으로 결정하여 행동할 수 있는 이성적 존재로 인식한다. ② 합의의 결과물인 실정법에 반하는 행위를 범죄로 규정하고, 범죄에 상응하는 제재(처벌)를 부과하여야 한다고 본다. ③ 일반시민에 대한 형벌의 위하효과를 통해 범죄예방을 추구한다. ④ 인간의 행동은 개인적 기질과 다양한 환경요인에 의하여 통제되고 결정된다고 본다."
124,2023,경위,범죄,4,4,법과 형사사법에 대한 갈등주의적 관점과 가장 거리가 먼 이론은?,① 챔블리스(Chambliss)의 마르크스주의 범죄이론 ② 체스니-린드(Chesney-Lind)의 페미니스트 범죄이론 ③ 블랙(Black)의 법행동이론 ④ 메스너(Messner)와 로젠펠드(Rosenfeld)의 제도적아노미이론
125,2023,경위,범죄,5,3,범죄행위에 영향을 미치는 뇌와 신경전달물질에 관한 설명으로 가장 적절하지 않은 것은?,"① 뇌의 변연계에 존재하는 편도체는 공포 및 분노와 관련되어 있다. ② 뇌의 전두엽은 욕구, 충동, 감정 관련 신경정보를 억제하거나 사회적 맥락에 맞게 조절, 제어, 표출하게 하는 집행기능을 수행한다. ③ 세로토닌 수치가 너무 높을 경우 충동, 욕구, 분노 등이 제대로 통제되지 않을 수 있다. ④ 도파민 시스템은 보상 및 쾌락과 관련되어 있다."
126,2023,경위,범죄,6,2,생물사회학적 범죄연구 사례에 대한 내용이다. 해당되는 연구는 무엇인가?,"마틴은 기독교 집안에서 자란 청년으로 미국 독립전쟁에 참전 후 귀가하던 도중 하룻밤 묵게 된 여관에서 지적장애를 가진 여성 종업원과 성관계를 맺었다. 그 후 자신의 고향에 돌아와 기독교인 여성과 결혼한 후 건실한 가정을 꾸리고 살았다. 연구자는 이 두 여성으로부터 태어난 마틴의 4대째 후손들까지를 조사하였는데, 이후에 결혼한 여성에게서 태어난 후손들 중에는 법률가, 성직자, 의사 등 사회적으로 성공한 사람들이 많았고 범죄자는 한 명도 없었다. 그에 비해 지적장애를 가진 여성 종업원으로부터 태어난 후손들은 절반 이상이 지적장애인이나 범죄자였다. 연구자는 이러한 연구결과를 토대로 부모의 범죄성향이 전적으로 유전에 의해 자식에게 대물림된다고 주장하였다. 하지만 이러한 연구결과만으로는 자식이 부모의 범죄성향을 닮은 이유가 순전히 유전에 의한 것인지 아니면 부모가 자식에게 제공한 환경의 영향 때문인지에 대해 명확한 해답을 제시할 수 없다는 비판을 받는다. ① 덕데일(Dugdale)의 쥬크(Juke)가문에 관한 연구 ② 고다드(Goddard)의 칼리카크(Kallikak)가문에 관한 연구 ③ 서덜랜드(Sutherland)의 조나단 에드워드(Jonathan Edward)가문에 관한 연구 ④ 제이콥스(Jacobs)와 스트롱(Strong)의 연구"
127,2023,경위,범죄,7,4,슈나이더(Schneider)의 정신병질에 대한 10가지 분류에 관해 기술한 것이다. 가장 적절하지 않은 것은?,"① 의지박약성–모든 환경에 저항을 상실하여 우왕좌왕하고, 지능이 낮은 성격적 특징을 가지고 있으며, 인내심과 저항력이 빈약하다. 상습범, 누범에서 이러한 정신병질이 많이 발견된다. ② 기분이변성 – 기분 동요가 많아서 예측이 곤란하고, 폭발성과 유사하나 정도가 낮은 특징을 가지고 있다. 방화범, 상해범에서 이러한 정신병질이 많이 발견된다. ③ 무력성 – 심신의 부조화 상태를 호소하여 타인의 동정을 바라고 신경질적인 특징을 보이나, 범죄와의 관련성은 적다. ④ 발양성 – 자신의 운명과 능력에 대해 과도하게 비관적이며, 경솔하고 불안정한 특징을 보인다. 현실가능성이 없는 약속을 남발하기도 한다. 상습사기범과 무전취식자 등에서 이러한 정신병질이 많이 발견된다."
128,2023,경위,범죄,8,4,심리학적 범죄이론에 대한 내용으로 가장 적절하지 않은 것은?,"① 심리학적 범죄이론에는 범죄자의 정신을 중심으로 범죄의 원인을 규명하려는 ‘정신분석이론’, 범죄자의 행위가 과거의 학습경험을 통해 발달한다고 파악하는 ‘행동이론’, 범죄자의 개인적 추론 과정이 행동에 미치는 영향을 바탕으로 범죄원인을 밝히고자 하는 ‘인지이론’, 각 개인의 성격적 결함에서 비행성을 찾으려는 ‘인성(성격)이론’ 등이 있다. ② 아이젠크(Eysenck)는 신경계적 특징과 범죄행동 및 성격특성 간의 관련성을 정신병적 경향성(Psychoticism), 외향성(Extroversion), 신경증(Neuroticism) 등 성격의 3가지 차원에서 설명하였다. ③ 헤어(Hare)는 사이코패스에 대한 표준화된 진단표(PCL-R)를 개발하였으며, 오늘날 사이코패스 검사 도구로 광범위하게 사용되고 있다. ④ 슈나이더(Schneider)는 대부분의 범죄자가 정신병질자이므로 정신치료에 초점을 맞추어야 한다고 주장하였다."
129,2023,경위,범죄,9,4,범죄원인론 중 고전학파에 대한 설명으로 가장 적절하지 않은 것은?,"① 고전학파는 범죄의 원인보다 형벌 제도의 개혁에 더 많은 관심을 기울였다. ② 고전주의 범죄학은 계몽주의 시대사조 속에서 중세 형사사법시스템을 비판하며 태동하였고, 근대 형사사법 개혁의 근간이 되는 이론적 토대를 제공하였다. ③ 고전주의 범죄학은 범죄를 설명함에 있어 인간이 자유의지(free-will)에 입각한 합리적 존재라는 기본가정을 바탕으로 한다. ④ 고전주의 범죄학은 처벌이 아닌 개별적 처우를 통한 교화개선을 가장 효과적인 범죄예방 대책으로 본다."
130,2023,경위,범죄,10,3,신고전주의 범죄학에 대한 다음 설명 중 그 내용이 가장 적절하지 않은 것은?,"① 합리적선택이론(Rational Choice Theory)은 사람들이 이윤을 극대화하고 손실을 최소화하기 위한 결정을 한다는 경제학의 기대효용원리에 기초하고 있다. ② 합리적선택이론에 따르면, 범죄자는 범행 여부에 대한 의사결정을 함에 있어 처벌의 가능성과 강도뿐 아니라 다양한 개인적, 상황적 요인을 포괄적으로 고려한다. ③ 일상활동이론(Routine Activity Theory)은 범죄 발생의 3요소 중 가해자의 범행 동기를 가장 중요한 요소로 제시한다. ④ 신고전주의 범죄학의 등장은 실증주의 범죄학 및 관련 정책의 효과에 대한 비판적 시각과 관련이 있다."
131,2023,경위,범죄,11,4,초기 통제이론들에 대한 다음 설명 중 가장 적절하지 않은 것은?,① 나이(Nye)는 가정을 사회통제의 가장 중요한 근본이라고 주장하였다. ② 리스(Reiss)는 개인이 스스로 욕구를 참아내는 능력인 개인적 통제력의 개념을 제시하였다. ③ 레클리스(Reckless)의 봉쇄이론(Containment Theory)은 청소년비행의 요인으로 내적배출요인과 외적유인요인이 있다고 하였다. ④ 토비(Toby)의 통제이론은 범죄를 통제하는 기제로서 자아의 역할을 특히 강조하였다.
132,2023,경위,범죄,12,1,시카고학파인 쇼(Shaw)와 맥케이(McKay)가 수행한 연구의 결과로 가장 적절하지 않은 것은?,① 지역 거주민의 인종과 민족이 바뀌었을 때 해당 지역의 범죄율도 함께 변했다. ② 시카고 시(市)의 전이지대(transition zone)에서 범죄율이 가장 높게 나타났다. ③ 새로운 이민자가 지속적으로 유입되면서 지역사회의 사회해체 상태가 초래되었다. ④ 범죄지역에서는 전통적 규범과 가치가 주민들의 행동을 제대로 통제하지 못했다.
133,2023,경위,범죄,13,1,서덜랜드(Sutherland)의 차별접촉이론(Differential Association Theory)에서 제시하는 명제로 가장 적절하지 않은 것은?,"① 범죄행위의 학습과정은 일반적 학습과정의 기제와 다르다. ② 범죄행위는 타인과의 의사소통에서 이루어지는 상호작용으로 학습된다. ③ 차별적 접촉은 교제의 빈도, 기간, 우선성, 강도에 있어 다양할 수 있다. ④ 범죄행위는 일반적인 욕구와 가치관으로 설명될 수 없다."
134,2023,경위,범죄,14,3,머튼(Merton)이 주장한 아노미의 발생원인과 가장 거리가 먼 것은?,① 물질적 성공만을 과도하게 강조하는 문화 ② 성공을 위한 제도화된 기회의 부족 ③ 급격한 사회변동과 위기 ④ 공평한 성공기회에 대한 평등주의적 이념
